number,value,datetime_start,datetime_complete,duration,params_batch_size,params_buffer_size,params_ent_coef,params_gamma,params_learning_starts,params_lr,params_n_sampled_goal,params_net_arch,params_random_exploration,params_target_entropy,params_train_freq,state
0,1.0442602634429932,2020-06-28 23:28:59.618867,2020-06-29 00:32:03.982707,0 days 01:03:04.363840000,256,1000000,auto,0.95,20000,0.5337417140875109,6,big,0.07732409615147551,auto,100,COMPLETE
1,0.8312775492668152,2020-06-29 00:32:03.984093,2020-06-29 00:53:25.792816,0 days 00:21:21.808723000,32,100000,auto,0.995,20000,4.3847879052649935e-05,1,medium,0.30665756120624366,-1,1,COMPLETE
2,3.3722128868103027,2020-06-29 00:53:25.794134,2020-06-29 01:16:20.945700,0 days 00:22:55.151566000,16,1000000,0.0001,0.999,1000,0.04164502471858184,6,big,0.7315363627998728,,300,COMPLETE
3,1.1154218912124634,2020-06-29 01:16:20.946955,2020-06-29 01:37:56.014042,0 days 00:21:35.067087000,32,10000,0.0001,0.995,1000,0.007192884044955923,4,big,0.3280236956484641,,100,COMPLETE
4,1.488250970840454,2020-06-29 01:37:56.015231,2020-06-29 01:50:31.273192,0 days 00:12:35.257961000,16,100000,0.1,0.95,0,1.4807893709024365e-05,2,medium,0.10917797496805959,,100,COMPLETE
5,1.5235300064086914,2020-06-29 01:50:31.274438,2020-06-29 02:41:11.659148,0 days 00:50:40.384710000,256,100000,0.01,0.9999,0,0.014552416900662552,1,medium,0.683294151018779,,1,COMPLETE
6,2.9748897552490234,2020-06-29 02:41:11.660375,2020-06-29 03:45:31.118434,0 days 01:04:19.458059000,256,10000,auto,0.9,0,0.00011317706981602306,2,big,0.5279764965279974,-10,300,COMPLETE
7,2.8521273136138916,2020-06-29 03:45:31.119623,2020-06-29 04:08:25.981790,0 days 00:22:54.862167000,64,100000,0.01,0.999,10000,0.0001431607986418203,8,big,0.23814275804335516,,1,COMPLETE
8,2.5666065216064453,2020-06-29 04:08:25.983039,2020-06-29 04:18:55.653526,0 days 00:10:29.670487000,128,100000,0.01,0.9999,1000,0.0007547564881376088,2,small,0.9696480289657625,,300,COMPLETE
9,2.2153477668762207,2020-06-29 04:18:55.654776,2020-06-29 04:49:14.688995,0 days 00:30:19.034219000,512,10000,0.5,0.95,10000,0.21951824192542888,8,small,0.6018122749699578,,1,COMPLETE
10,1.3701938390731812,2020-06-29 04:49:14.690175,2020-06-29 05:04:40.959347,0 days 00:15:26.269172000,32,100000,0.05,0.99,20000,2.5695416390578346e-05,1,medium,0.3434984888481025,,10,COMPLETE
11,1.0442602634429932,2020-06-29 05:04:40.960596,2020-06-29 05:20:46.136815,0 days 00:16:05.176219000,32,1000000,auto,0.995,20000,0.7372288812042652,6,medium,0.05562995377205609,-50,100,COMPLETE
12,2.8654797077178955,2020-06-29 05:20:46.138108,2020-06-29 05:57:33.311941,0 days 00:36:47.173833000,256,1000000,auto,0.98,20000,0.0016132856029157847,6,medium,0.021007663101014873,-10,10,COMPLETE
13,0.8999649882316589,2020-06-29 05:57:33.313237,2020-06-29 07:12:58.961260,0 days 01:15:25.648023000,512,1000000,auto,0.95,20000,0.09249536626388104,1,big,0.1899106005098239,-1,1,COMPLETE
14,1.9980745315551758,2020-06-29 07:12:58.962572,2020-06-29 07:24:36.195358,0 days 00:11:37.232786000,512,1000000,auto,0.995,20000,0.07369771618442346,1,medium,0.2571150823232524,-100,1,PRUNED
15,2.7491002082824707,2020-06-29 07:24:36.373967,2020-06-29 07:51:11.359168,0 days 00:26:34.985201000,512,1000000,0.5,0.995,20000,0.00032173601213860483,1,small,0.35625265705735687,,1,COMPLETE
16,2.870043992996216,2020-06-29 07:51:11.360453,2020-06-29 08:06:52.854163,0 days 00:15:41.493710000,32,100000,auto,0.95,20000,0.005014354825124668,1,big,0.18597014114555913,auto,1,COMPLETE
17,0.8735666275024414,2020-06-29 08:06:52.855445,2020-06-29 09:08:32.956826,0 days 01:01:40.101381000,512,1000000,0.05,0.98,20000,0.03358214290476235,1,medium,0.44211196637113914,,1,COMPLETE
18,1.6798263788223267,2020-06-29 09:08:32.958126,2020-06-29 10:10:33.628248,0 days 01:02:00.670122000,512,100000,0.05,0.98,20000,0.022556822206421707,4,medium,0.4411812993093005,,1,COMPLETE
19,1.7220821380615234,2020-06-29 10:10:33.629544,2020-06-29 10:38:33.791181,0 days 00:28:00.161637000,128,1000000,0.05,0.98,10000,5.767103784033839e-05,1,medium,0.860941767116749,,10,COMPLETE
20,1.7769076824188232,2020-06-29 10:38:33.792548,2020-06-29 10:58:56.491759,0 days 00:20:22.699211000,64,10000,0.1,0.98,20000,0.0018819446034770426,1,medium,0.446615500741301,,1,COMPLETE
21,6.844338417053223,2020-06-29 10:58:56.493096,2020-06-29 11:11:25.696391,0 days 00:12:29.203295000,512,1000000,0.05,0.9,20000,0.12310331708693717,1,medium,0.5171385493354632,,1,PRUNED
22,0.8999649882316589,2020-06-29 11:11:25.890622,2020-06-29 12:51:23.283077,0 days 01:39:57.392455000,512,1000000,auto,0.99,20000,0.2090419894961162,1,big,0.1659886629034479,-50,1,COMPLETE
23,4.795297622680664,2020-06-29 12:51:23.284533,2020-06-29 14:08:52.523761,0 days 01:17:29.239228000,512,1000000,0.05,0.99,20000,0.3719409808865919,1,medium,0.41747004744837746,,1,COMPLETE
24,0.8999649882316589,2020-06-29 14:08:52.525172,2020-06-29 14:28:53.607558,0 days 00:20:01.082386000,32,1000000,auto,0.95,20000,0.046998183388691786,1,big,0.31845004800193816,-20,1,COMPLETE
25,2.871598482131958,2020-06-29 14:28:53.608929,2020-06-29 14:30:48.892674,0 days 00:01:55.283745000,32,1000000,0.05,0.98,20000,0.015304540119208395,8,small,0.2969162788915811,,1,PRUNED
26,1.5410040616989136,2020-06-29 14:30:49.241733,2020-06-29 15:40:48.702868,0 days 01:09:59.461135000,512,100000,auto,0.99,20000,0.16574849206660278,4,medium,0.14010477807331356,-1,1,COMPLETE
27,0.9759319424629211,2020-06-29 15:40:48.704385,2020-06-29 16:57:13.295604,0 days 01:16:24.591219000,512,1000000,0.1,0.995,20000,0.028559985517702745,1,medium,0.2230371131152467,,1,COMPLETE
28,1.986370325088501,2020-06-29 16:57:13.296865,2020-06-29 17:14:45.633614,0 days 00:17:32.336749000,16,100000,0.5,0.9,1000,0.0075952216278223775,1,big,0.5682197187833853,,1,COMPLETE
29,5.775386810302734,2020-06-29 17:14:45.634978,2020-06-29 17:21:23.782147,0 days 00:06:38.147169000,32,1000000,0.0001,0.95,0,0.046106374247817494,1,big,0.39917078671511896,,10,PRUNED
30,1.712430715560913,2020-06-29 17:21:23.974523,2020-06-29 17:47:03.055128,0 days 00:25:39.080605000,128,1000000,auto,0.99,10000,0.9995572835881883,1,medium,0.0015699711539347017,-1,300,COMPLETE
31,0.8999649882316589,2020-06-29 17:47:03.056416,2020-06-29 18:04:34.695196,0 days 00:17:31.638780000,32,1000000,auto,0.99,20000,0.4245876579426205,1,big,0.2850203448694968,-1,1,COMPLETE
32,0.8999649882316589,2020-06-29 18:04:34.696656,2020-06-29 18:24:56.307949,0 days 00:20:21.611293000,32,1000000,auto,0.999,20000,0.4564739173246723,1,big,0.28499572638947046,-1,1,COMPLETE
33,1.0442602634429932,2020-06-29 18:24:56.309355,2020-06-29 18:47:16.460810,0 days 00:22:20.151455000,32,1000000,auto,0.999,20000,0.06558797353316419,6,big,0.35478894260883304,-1,1,COMPLETE
34,3.2144017219543457,2020-06-29 18:47:16.462411,2020-06-29 19:08:23.932022,0 days 00:21:07.469611000,32,1000000,0.0001,0.995,20000,0.0031578299202312185,1,big,0.6337101153449818,,100,COMPLETE
35,1.0758239030838013,2020-06-29 19:08:23.933476,2020-06-29 19:35:49.421233,0 days 00:27:25.487757000,32,1000000,auto,0.999,1000,0.3904542422941597,4,big,0.2880686790745956,-20,1,COMPLETE
36,1.419255018234253,2020-06-29 19:35:49.422666,2020-06-29 19:57:35.091080,0 days 00:21:45.668414000,32,10000,auto,0.999,20000,0.5298775076457721,2,big,0.4762379234965152,-1,100,COMPLETE
37,2.739379405975342,2020-06-29 19:57:35.092618,2020-06-29 20:06:34.570628,0 days 00:08:59.478010000,16,100000,auto,0.999,0,1.2367993158278013e-05,1,big,0.3965217543685945,-50,1,PRUNED
38,4.186976909637451,2020-06-29 20:06:34.780817,2020-06-29 20:33:56.083242,0 days 00:27:21.302425000,64,1000000,0.1,0.9999,20000,0.011174446840133082,1,big,0.12423641417201692,,300,COMPLETE
39,1.2301403284072876,2020-06-29 20:33:56.084663,2020-06-29 20:55:45.808026,0 days 00:21:49.723363000,32,100000,0.01,0.95,1000,0.033751349131805934,8,medium,0.7792470303690977,,1,COMPLETE
40,1.9304046630859375,2020-06-29 20:55:45.809458,2020-06-29 21:10:44.367074,0 days 00:14:58.557616000,256,10000,0.0001,0.999,20000,0.287395420669703,2,small,0.26705204025307133,,1,COMPLETE
41,0.8999649882316589,2020-06-29 21:10:44.368612,2020-06-29 22:45:49.747915,0 days 01:35:05.379303000,512,1000000,auto,0.95,20000,0.11933341172651206,1,big,0.18666345015169034,-50,1,COMPLETE
42,0.8999649882316589,2020-06-29 22:45:49.749615,2020-06-29 23:08:29.223414,0 days 00:22:39.473799000,32,1000000,auto,0.99,20000,0.8348881040274436,1,big,0.07441986592971603,-20,1,COMPLETE
43,0.8999649882316589,2020-06-29 23:08:29.224912,2020-06-29 23:30:11.668900,0 days 00:21:42.443988000,32,1000000,auto,0.99,20000,0.9936874410299024,1,big,0.09607375454316167,-20,1,COMPLETE
44,0.8999649882316589,2020-06-29 23:30:11.670454,2020-06-29 23:51:22.815525,0 days 00:21:11.145071000,32,1000000,auto,0.9999,20000,0.6685007270367938,1,big,0.22498495415105035,-20,1,COMPLETE
45,5.775386810302734,2020-06-29 23:51:22.817100,2020-06-30 00:32:29.647581,0 days 00:41:06.830481000,512,1000000,0.01,0.99,0,0.1415201207945556,1,big,0.05248184653305582,,300,PRUNED
46,1.0442602634429932,2020-06-30 00:32:29.863245,2020-06-30 00:53:24.289044,0 days 00:20:54.425799000,16,1000000,auto,0.99,20000,0.8360522890437501,6,big,0.0886025663277111,-20,1,COMPLETE
47,6.6240644454956055,2020-06-30 00:53:24.290596,2020-06-30 00:59:15.510170,0 days 00:05:51.219574000,32,100000,0.05,0.9999,10000,0.6727966771189635,1,medium,0.08825841185836837,,100,PRUNED
48,4.795297622680664,2020-06-30 00:59:15.717975,2020-06-30 02:17:11.138129,0 days 01:17:55.420154000,512,1000000,0.5,0.9999,20000,0.1953689388414455,1,medium,0.19342080267571352,,1,COMPLETE
49,2.2067227363586426,2020-06-30 02:17:11.139605,2020-06-30 02:21:41.689236,0 days 00:04:30.549631000,32,1000000,auto,0.9999,20000,0.00045718763840875014,8,big,0.3297759332661876,-20,10,PRUNED
50,2.8639469146728516,2020-06-30 02:21:42.078915,2020-06-30 02:31:13.740567,0 days 00:09:31.661652000,32,100000,auto,0.995,20000,3.096216401365755e-05,1,small,0.23038653269897108,-50,1,COMPLETE
51,5.2974371910095215,2020-06-30 02:31:13.742192,2020-06-30 04:00:39.891788,0 days 01:29:26.149596000,512,1000000,auto,0.95,20000,0.05831555125674583,1,big,0.1429041393571629,-100,1,PRUNED
52,0.8999649882316589,2020-06-30 04:00:40.145917,2020-06-30 04:21:55.051957,0 days 00:21:14.906040000,32,1000000,auto,0.99,20000,0.9746944479724817,1,big,0.4763386201086749,-1,1,COMPLETE
53,0.8999649882316589,2020-06-30 04:21:55.053488,2020-06-30 04:43:15.964801,0 days 00:21:20.911313000,32,1000000,auto,0.99,20000,0.8195780588329008,1,big,0.5626997255386351,-1,1,COMPLETE
54,4.795297622680664,2020-06-30 04:43:15.966413,2020-06-30 05:04:07.451175,0 days 00:20:51.484762000,32,1000000,auto,0.99,20000,0.00018390481848732005,1,big,0.5632939373910567,-100,1,COMPLETE
55,5.7752485275268555,2020-06-30 05:04:07.452620,2020-06-30 05:21:31.220148,0 days 00:17:23.767528000,32,1000000,0.05,0.98,20000,0.9430525202659307,2,big,0.4683783772537917,,1,COMPLETE
56,0.591924786567688,2020-06-30 05:21:31.221802,2020-06-30 06:06:20.842445,0 days 00:44:49.620643000,256,10000,auto,0.99,20000,0.001025699215141441,1,medium,0.642423627812771,auto,1,COMPLETE
57,5.87348747253418,2020-06-30 06:06:20.844017,2020-06-30 06:51:12.284000,0 days 00:44:51.439983000,256,10000,auto,0.98,20000,0.0011442335088186534,4,medium,0.6747585591409446,auto,1,COMPLETE
58,5.358550071716309,2020-06-30 06:51:12.285700,2020-06-30 07:37:32.946029,0 days 00:46:20.660329000,256,10000,0.05,0.99,20000,8.67082732340559e-05,1,medium,0.7381459591396671,,1,COMPLETE
59,1.966156244277954,2020-06-30 07:37:32.947612,2020-06-30 08:27:41.089416,0 days 00:50:08.141804000,256,10000,0.1,0.95,10000,0.09408195087843871,1,medium,0.5589142356070286,,1,COMPLETE
60,0.9420612454414368,2020-06-30 08:27:41.091330,2020-06-30 08:58:42.038975,0 days 00:31:00.947645000,128,10000,0.01,0.95,20000,0.022258119643145745,6,medium,0.3742936246669736,,10,COMPLETE
61,0.8999649882316589,2020-06-30 08:58:42.040539,2020-06-30 09:18:32.233934,0 days 00:19:50.193395000,64,10000,auto,0.995,20000,0.28888953556041813,1,medium,0.3063361530510343,auto,1,COMPLETE
62,0.8999649882316589,2020-06-30 09:18:32.235246,2020-06-30 09:35:52.340996,0 days 00:17:20.105750000,64,10000,auto,0.995,20000,0.08937882524772689,1,medium,0.33052585348520913,auto,1,COMPLETE
63,0.8963069915771484,2020-06-30 09:35:52.342298,2020-06-30 10:23:29.707480,0 days 00:47:37.365182000,256,1000000,auto,0.99,20000,2.8651469555587345e-05,1,big,0.6136719350565435,auto,1,COMPLETE
64,2.930077075958252,2020-06-30 10:23:29.709115,2020-06-30 10:47:53.594847,0 days 00:24:23.885732000,64,10000,auto,0.995,20000,3.196001982296006e-05,1,medium,0.62580608330762,auto,1,COMPLETE
65,0.8228452801704407,2020-06-30 10:47:53.596378,2020-06-30 11:23:14.787738,0 days 00:35:21.191360000,256,100000,0.5,0.9,20000,2.0237818671324006e-05,1,medium,0.25682007771146026,,1,COMPLETE
66,0.9611232876777649,2020-06-30 11:23:14.789253,2020-06-30 11:40:58.122371,0 days 00:17:43.333118000,64,10000,0.5,0.9,20000,2.1020945712574792e-05,1,medium,0.5181273220980935,,1,COMPLETE
67,1.961267113685608,2020-06-30 11:40:58.123802,2020-06-30 12:24:56.294735,0 days 00:43:58.170933000,256,100000,0.5,0.9,1000,1.6879094170686855e-05,1,medium,0.6693579851529821,,1,COMPLETE
68,1.3427139520645142,2020-06-30 12:24:56.296298,2020-06-30 13:00:36.686744,0 days 00:35:40.390446000,256,100000,0.5,0.9,20000,0.00023170450936887914,1,medium,0.7386663938017264,,300,COMPLETE
69,2.57582426071167,2020-06-30 13:00:36.688374,2020-06-30 13:16:00.877333,0 days 00:15:24.188959000,256,100000,0.5,0.9999,0,5.346600201989605e-05,1,medium,0.6070182496035169,,1,PRUNED
70,2.1404647827148438,2020-06-30 13:16:01.065008,2020-06-30 13:52:27.805591,0 days 00:36:26.740583000,256,100000,0.05,0.98,20000,0.0038556778494185542,8,medium,0.4258869386867816,,1,COMPLETE
71,1.9571861028671265,2020-06-30 13:52:27.807168,2020-06-30 14:01:10.473958,0 days 00:08:42.666790000,256,1000000,auto,0.95,20000,1.065942453295353e-05,1,big,0.25987132628109055,-10,1,PRUNED
72,2.017767906188965,2020-06-30 14:01:10.665169,2020-06-30 14:15:06.950364,0 days 00:13:56.285195000,256,100000,auto,0.95,20000,4.6752191749243534e-05,1,big,0.15728778053943898,auto,1,PRUNED
73,6.918172359466553,2020-06-30 14:15:07.195926,2020-06-30 14:18:33.720589,0 days 00:03:26.524663000,256,1000000,0.0001,0.99,20000,7.575680430423782e-05,1,small,0.5397233137018959,,1,PRUNED
74,2.5049667358398438,2020-06-30 14:18:33.930328,2020-06-30 14:34:36.993851,0 days 00:16:03.063523000,512,1000000,auto,0.99,20000,0.009386371361465756,1,medium,0.6956791857417954,-50,100,PRUNED
75,0.8999649882316589,2020-06-30 14:34:37.217834,2020-06-30 14:53:30.716535,0 days 00:18:53.498701000,64,10000,auto,0.995,20000,0.30386309820798213,1,medium,0.3770920114693101,auto,1,COMPLETE
76,4.7631425857543945,2020-06-30 14:53:30.718243,2020-06-30 15:30:48.444655,0 days 00:37:17.726412000,256,10000,0.5,0.995,20000,0.5120914554126285,4,medium,0.3804938769801964,,1,PRUNED
77,3.677428722381592,2020-06-30 15:30:48.625281,2020-06-30 15:54:19.296136,0 days 00:23:30.670855000,512,100000,auto,0.99,20000,4.1017210277751283e-05,1,big,0.5941212948123653,-10,1,PRUNED
78,2.5027289390563965,2020-06-30 15:54:19.510343,2020-06-30 16:17:20.635893,0 days 00:23:01.125550000,64,10000,auto,0.9,20000,0.002266490607115722,1,medium,0.4473296332467439,auto,1,COMPLETE
79,3.7680087089538574,2020-06-30 16:17:20.637614,2020-06-30 16:52:38.948675,0 days 00:35:18.311061000,128,1000000,0.05,0.99,10000,0.00011627021798056162,2,big,0.20282754765159136,,1,COMPLETE
80,1.0221723318099976,2020-06-30 16:52:38.950286,2020-06-30 17:08:40.194076,0 days 00:16:01.243790000,16,1000000,auto,0.99,20000,1.5632607757130553e-05,1,big,0.02522682791258149,-20,1,COMPLETE
81,0.8999649882316589,2020-06-30 17:08:40.195673,2020-06-30 18:24:36.869528,0 days 01:15:56.673855000,512,1000000,auto,0.95,20000,0.04078730905815277,1,big,0.18418087850927362,-20,1,COMPLETE
82,0.8999649882316589,2020-06-30 18:24:36.871038,2020-06-30 19:43:56.003386,0 days 01:19:19.132348000,512,1000000,auto,0.95,20000,0.03495855606051688,1,big,0.180526773621631,auto,1,COMPLETE
83,0.8999649882316589,2020-06-30 19:43:56.004984,2020-06-30 20:00:35.605200,0 days 00:16:39.600216000,32,1000000,auto,0.999,20000,0.12126483461161311,1,big,0.28096323757174396,auto,1,COMPLETE
84,0.8999649882316589,2020-06-30 20:00:35.606867,2020-06-30 21:20:55.434892,0 days 01:20:19.828025000,512,1000000,auto,0.999,20000,0.025011838635583088,1,big,0.26372671972649475,-50,1,COMPLETE
85,4.795297622680664,2020-06-30 21:20:55.436528,2020-06-30 21:38:06.182205,0 days 00:17:10.745677000,32,1000000,0.1,0.99,20000,0.47531284726479356,1,big,0.24258888141246013,,10,COMPLETE
86,1.401199460029602,2020-06-30 21:38:06.183729,2020-06-30 23:07:49.077723,0 days 01:29:42.893994000,512,1000000,auto,0.98,1000,0.1665092148758062,6,big,0.3003782285171697,-50,1,COMPLETE
87,2.1055855751037598,2020-06-30 23:07:49.079300,2020-06-30 23:24:41.919278,0 days 00:16:52.839978000,32,100000,auto,0.9,0,0.0005724519573727768,1,big,0.12098231169427942,-1,1,COMPLETE
88,1.0284883975982666,2020-06-30 23:24:41.920821,2020-06-30 23:35:18.862008,0 days 00:10:36.941187000,256,1000000,0.01,0.999,20000,0.05742809585931489,1,small,0.3110806364141293,,300,COMPLETE
89,6.844338417053223,2020-06-30 23:35:18.863519,2020-06-30 23:37:55.828444,0 days 00:02:36.964925000,32,1000000,0.0001,0.9999,20000,0.017092661256364116,1,big,0.21907470398848244,,1,PRUNED
90,0.6859310269355774,2020-06-30 23:37:55.999910,2020-06-30 23:51:13.282597,0 days 00:13:17.282687000,32,1000000,0.05,0.9999,20000,2.3462185225332566e-05,1,medium,0.21100984195093309,,100,COMPLETE
91,0.9019907116889954,2020-06-30 23:51:13.284112,2020-07-01 00:07:24.704990,0 days 00:16:11.420878000,32,1000000,0.05,0.99,20000,2.1971468779388436e-05,1,medium,0.10204572700667447,,100,COMPLETE
92,0.9499934315681458,2020-07-01 00:07:24.706619,2020-07-01 00:23:38.964696,0 days 00:16:14.258077000,32,1000000,0.05,0.99,20000,3.550066265633029e-05,1,medium,0.48236613064983574,,100,COMPLETE
93,0.9702681303024292,2020-07-01 00:23:38.966330,2020-07-01 01:02:43.451839,0 days 00:39:04.485509000,256,10000,0.05,0.995,20000,2.487568834976354e-05,1,medium,0.05947892708070769,,100,COMPLETE
94,4.1180009841918945,2020-07-01 01:02:43.453236,2020-07-01 01:21:44.202423,0 days 00:19:00.749187000,64,100000,0.05,0.995,20000,1.0466051238650636e-05,1,medium,0.0645773197568508,,100,COMPLETE
95,0.8999649882316589,2020-07-01 01:21:44.204060,2020-07-01 02:26:46.488926,0 days 01:05:02.284866000,512,1000000,auto,0.95,20000,0.04573751104591279,1,medium,0.1639024804512041,auto,100,COMPLETE
96,3.180119037628174,2020-07-01 02:26:46.490576,2020-07-01 02:30:35.859200,0 days 00:03:49.368624000,32,1000000,0.5,0.9999,20000,0.6180083910835399,8,big,0.002309410841119519,,1,PRUNED
97,0.8999649882316589,2020-07-01 02:30:36.206925,2020-07-01 03:16:17.001014,0 days 00:45:40.794089000,256,10000,auto,0.995,20000,0.3147407907461578,1,medium,0.35005150051962347,-20,1,COMPLETE
98,3.4406094551086426,2020-07-01 03:16:17.002614,2020-07-01 03:35:24.249320,0 days 00:19:07.246706000,32,1000000,0.05,0.9999,20000,1.7598233287180524e-05,1,big,0.6439789470590788,,1,PRUNED
99,1.5410040616989136,2020-07-01 03:35:24.496073,2020-07-01 03:55:42.560184,0 days 00:20:18.064111000,32,1000000,auto,0.9999,20000,0.40630935386301403,4,medium,0.2425530796947285,-20,1,COMPLETE
