number,value,datetime_start,datetime_complete,duration,params_batch_size,params_gamma,params_lr,params_memory_limit,params_noise_std,params_noise_type,params_normalize_observations,params_normalize_returns,state
0,1.49874746799469,2020-06-20 20:21:34.672538,2020-06-20 23:33:43.661415,0 days 03:12:08.988877000,64,0.98,0.0010957502936774235,1000000,0.2496686924367213,adaptive-param,True,True,COMPLETE
1,4.243607521057129,2020-06-20 20:21:34.673226,2020-06-20 22:38:54.801749,0 days 02:17:20.128523000,32,0.995,0.03050994480761025,100000,0.20192736323796268,adaptive-param,True,False,PRUNED
2,2.602383852005005,2020-06-20 20:21:34.673679,2020-06-20 23:29:26.780815,0 days 03:07:52.107136000,64,0.995,0.6864013871338194,100000,0.0026755981953909824,ornstein-uhlenbeck,True,True,COMPLETE
3,2.4878666400909424,2020-06-20 20:21:34.685435,2020-06-20 23:34:33.013181,0 days 03:12:58.327746000,64,0.9,0.0014709261876296135,100000,0.4133392103152631,adaptive-param,True,True,COMPLETE
4,1.593005895614624,2020-06-20 20:21:34.697595,2020-06-21 00:58:05.918775,0 days 04:36:31.221180000,128,0.95,1.4464314974692894e-05,100000,0.4765561514110228,ornstein-uhlenbeck,False,False,COMPLETE
5,1.629064917564392,2020-06-20 20:21:34.698382,2020-06-21 00:58:59.688615,0 days 04:37:24.990233000,128,0.995,0.0025647921962022348,1000000,0.14749443073619417,normal,False,True,COMPLETE
6,0.4940311312675476,2020-06-20 20:21:34.698853,2020-06-21 04:17:05.040527,0 days 07:55:30.341674000,256,0.995,0.09483468362138897,1000000,0.9785427155241576,ornstein-uhlenbeck,False,False,COMPLETE
7,4.334537982940674,2020-06-20 20:21:34.699295,2020-06-20 23:40:21.233344,0 days 03:18:46.534049000,128,0.995,0.008061323032533636,1000000,0.8068932798396691,normal,True,True,PRUNED
8,4.856691360473633,2020-06-20 20:21:34.699725,2020-06-20 23:33:49.648726,0 days 03:12:14.949001000,256,0.999,1.0578746860015592e-05,1000000,0.126723971027632,ornstein-uhlenbeck,True,True,PRUNED
9,1.3740535974502563,2020-06-20 20:21:34.700107,2020-06-20 23:30:10.475483,0 days 03:08:35.775376000,64,0.95,0.23664172733991334,1000000,0.35668500963619265,adaptive-param,False,False,COMPLETE
10,3.812164306640625,2020-06-20 20:21:34.700722,2020-06-20 22:45:51.588919,0 days 02:24:16.888197000,128,0.95,0.00019315119687436885,1000000,0.4096654768591008,adaptive-param,False,True,PRUNED
11,9.488561630249023,2020-06-20 20:21:34.701180,2020-06-20 22:08:02.391732,0 days 01:46:27.690552000,16,0.9,0.0024888439414244867,1000000,0.8704237157327073,ornstein-uhlenbeck,True,True,COMPLETE
12,0.3668524920940399,2020-06-20 20:21:34.701586,2020-06-21 04:38:16.826504,0 days 08:16:42.124918000,256,0.95,0.005826623072424897,10000,0.3927762687497923,adaptive-param,True,False,COMPLETE
13,0.9747434854507446,2020-06-20 20:21:34.708503,2020-06-20 22:14:35.257815,0 days 01:53:00.549312000,16,0.95,0.01626941350803614,100000,0.2576990830542879,adaptive-param,True,True,COMPLETE
14,0.22258774936199188,2020-06-20 20:21:34.709063,2020-06-20 23:26:55.485842,0 days 03:05:20.776779000,64,0.999,0.00013107712304401227,10000,0.16151152381197886,ornstein-uhlenbeck,True,True,COMPLETE
15,3.082643508911133,2020-06-20 20:21:34.709408,2020-06-20 22:41:07.869874,0 days 02:19:33.160466000,128,0.95,0.01645520233737023,10000,0.12323613828096813,ornstein-uhlenbeck,False,False,PRUNED
16,6.637887001037598,2020-06-20 20:21:34.709779,2020-06-20 22:14:24.484774,0 days 01:52:49.774995000,16,0.995,0.013553822741518387,10000,0.08611671820325584,adaptive-param,True,True,COMPLETE
17,2.2360644340515137,2020-06-20 20:21:34.710387,2020-06-20 22:35:39.613485,0 days 02:14:04.903098000,32,0.995,0.1322152265620808,10000,0.5179011434598335,ornstein-uhlenbeck,True,False,COMPLETE
18,5.875092029571533,2020-06-20 20:21:34.710739,2020-06-20 23:54:23.632089,0 days 03:32:48.921350000,256,0.999,0.00432628210442781,100000,0.34743592419145,normal,False,True,PRUNED
19,5.650884628295898,2020-06-20 20:21:34.711163,2020-06-20 22:27:11.165756,0 days 02:05:36.454593000,32,0.95,0.11842290346131101,100000,0.05136355457558173,normal,False,True,COMPLETE
20,2.0117361545562744,2020-06-20 20:21:34.711507,2020-06-20 21:59:56.016694,0 days 01:38:21.305187000,16,0.999,0.019415105855830006,100000,0.24852483400976888,ornstein-uhlenbeck,False,False,COMPLETE
21,4.359310626983643,2020-06-20 20:21:34.725813,2020-06-20 21:59:48.152342,0 days 01:38:13.426529000,16,0.995,0.0028120220451925263,1000000,0.5069720261107582,ornstein-uhlenbeck,False,True,COMPLETE
22,4.022187232971191,2020-06-20 20:21:34.726262,2020-06-20 22:03:53.895755,0 days 01:42:19.169493000,16,0.995,0.00018513738492103538,1000000,0.11899931930333385,normal,True,False,COMPLETE
23,2.9792158603668213,2020-06-20 20:21:34.737102,2020-06-20 22:41:00.249425,0 days 02:19:25.512323000,128,0.99,0.6353232219255137,100000,0.31674437957351465,normal,False,True,PRUNED
24,3.061030626296997,2020-06-20 20:21:34.737931,2020-06-21 01:07:02.761619,0 days 04:45:28.023688000,128,0.9,5.4993907263839035e-05,10000,0.8914491123089934,adaptive-param,False,False,COMPLETE
25,1.1770379543304443,2020-06-20 20:21:34.738405,2020-06-21 04:15:05.858543,0 days 07:53:31.120138000,256,0.99,0.0004415673514783653,10000,0.9940483199067307,normal,False,True,COMPLETE
26,1.9397046566009521,2020-06-20 20:21:34.738875,2020-06-20 22:07:34.679217,0 days 01:45:59.940342000,16,0.999,0.014810378408484306,100000,0.0564556867891296,normal,True,False,COMPLETE
27,2.836986541748047,2020-06-20 20:21:34.739532,2020-06-20 22:30:34.958375,0 days 02:09:00.218843000,32,0.95,2.128627749643133e-05,1000000,0.44545357858828605,adaptive-param,False,False,COMPLETE
28,2.688537120819092,2020-06-20 20:21:34.757984,2020-06-20 23:19:04.818666,0 days 02:57:30.060682000,64,0.9999,0.11198593264005854,10000,0.8861663284612535,normal,False,False,COMPLETE
29,1.1677050590515137,2020-06-20 20:21:34.891063,2020-06-21 04:17:39.216592,0 days 07:56:04.325529000,256,0.98,0.0004383689701311549,100000,0.6375278491511909,normal,False,False,COMPLETE
30,3.8694300651550293,2020-06-20 20:21:35.060644,2020-06-20 22:46:50.992225,0 days 02:25:15.931581000,128,0.98,0.0366635125920583,1000000,0.7472708711321188,adaptive-param,False,False,PRUNED
31,5.676955223083496,2020-06-20 20:21:35.082759,2020-06-20 22:34:54.858465,0 days 02:13:19.775706000,32,0.995,0.477967656077225,10000,0.06652649537350463,adaptive-param,False,False,COMPLETE
32,1.0591511726379395,2020-06-20 21:59:48.180268,2020-06-21 00:43:29.904699,0 days 02:43:41.724431000,64,0.99,6.947639794297395e-05,10000,0.589427557234745,normal,False,True,COMPLETE
33,2.0829570293426514,2020-06-20 21:59:56.035518,2020-06-21 02:27:33.920305,0 days 04:27:37.884787000,128,0.995,0.00011804515178672394,1000000,0.9607119517896339,ornstein-uhlenbeck,False,False,COMPLETE
34,2.026491641998291,2020-06-20 22:03:53.920985,2020-06-21 01:39:03.798027,0 days 03:35:09.877042000,256,0.95,0.06337778879112402,1000000,0.02936921885305621,adaptive-param,False,False,PRUNED
35,1.1217377185821533,2020-06-20 22:07:34.689741,2020-06-20 23:40:43.159796,0 days 01:33:08.470055000,16,0.95,0.0057020210616112585,1000000,0.1270913623906279,ornstein-uhlenbeck,True,False,COMPLETE
36,4.294448375701904,2020-06-20 22:08:02.418025,2020-06-20 23:06:33.781357,0 days 00:58:31.363332000,64,0.99,1.439213305523763e-05,100000,0.16174886790477205,ornstein-uhlenbeck,True,True,PRUNED
37,1.5014442205429077,2020-06-20 22:14:24.497805,2020-06-21 05:52:24.208556,0 days 07:37:59.710751000,256,0.9,1.725222950615086e-05,100000,0.013847259176702154,adaptive-param,False,True,COMPLETE
38,2.138098955154419,2020-06-20 22:14:35.270700,2020-06-21 00:58:30.094476,0 days 02:43:54.823776000,64,0.995,0.023918630161616605,100000,0.5275822049543193,ornstein-uhlenbeck,False,False,COMPLETE
39,2.520237445831299,2020-06-20 22:27:11.180804,2020-06-21 00:17:23.812195,0 days 01:50:12.631391000,32,0.99,0.0003794947777750838,100000,0.2321639193620516,normal,False,True,COMPLETE
40,3.6955952644348145,2020-06-20 22:30:34.967473,2020-06-21 00:30:31.983868,0 days 01:59:57.016395000,32,0.995,0.00046270370766868067,100000,0.9623135224048305,adaptive-param,True,False,COMPLETE
41,0.2269422709941864,2020-06-20 22:34:54.882903,2020-06-21 03:13:38.440824,0 days 04:38:43.557921000,128,0.9999,0.0002449337592453387,100000,0.7124677405276401,adaptive-param,True,True,COMPLETE
42,0.8657711148262024,2020-06-20 22:35:39.629315,2020-06-21 05:54:55.826123,0 days 07:19:16.196808000,256,0.98,0.0005731007486738791,100000,0.32435977138300726,normal,True,True,COMPLETE
43,0.9546195268630981,2020-06-20 22:38:56.729473,2020-06-21 03:09:52.129804,0 days 04:30:55.400331000,128,0.999,0.0005597078817429418,100000,0.3110838156565484,normal,True,True,COMPLETE
44,0.5376682877540588,2020-06-20 22:41:01.906803,2020-06-21 01:27:19.395152,0 days 02:46:17.488349000,64,0.98,0.0003251560359000081,100000,0.7187455992694297,normal,True,True,COMPLETE
45,0.32267364859580994,2020-06-20 22:41:09.569020,2020-06-21 01:27:13.790195,0 days 02:46:04.221175000,64,0.98,0.00040678557618085525,100000,0.7132843198501453,normal,True,True,COMPLETE
46,1.7057020664215088,2020-06-20 22:45:53.264360,2020-06-21 05:57:16.637023,0 days 07:11:23.372663000,256,0.999,0.0006789275649183645,100000,0.726507128459653,normal,True,True,COMPLETE
47,1.9887291193008423,2020-06-20 22:46:52.569884,2020-06-21 01:33:00.133165,0 days 02:46:07.563281000,64,0.9999,0.0011787047731943881,100000,0.3235915056576552,normal,True,True,COMPLETE
48,0.617641270160675,2020-06-20 23:06:35.457242,2020-06-21 06:06:51.461429,0 days 07:00:16.004187000,256,0.999,0.0005187252297665664,100000,0.005983639924984734,normal,True,True,COMPLETE
49,4.4054341316223145,2020-06-20 23:19:04.830125,2020-06-21 01:56:55.918046,0 days 02:37:51.087921000,256,0.999,0.0005871114938765292,100000,0.6194540321630891,normal,True,True,PRUNED
50,3.8054909706115723,2020-06-20 23:26:55.495075,2020-06-21 05:00:04.809531,0 days 05:33:09.314456000,256,0.999,0.0007328219072763449,10000,0.3207181514697117,adaptive-param,True,True,PRUNED
51,0.8540307283401489,2020-06-20 23:29:26.790580,2020-06-21 06:16:34.214382,0 days 06:47:07.423802000,256,0.999,0.0005317271834628048,10000,0.6076468133836089,adaptive-param,True,True,COMPLETE
52,0.7749170660972595,2020-06-20 23:30:10.482728,2020-06-21 06:16:01.111130,0 days 06:45:50.628402000,256,0.999,0.00029317432458673704,10000,0.28583018182858216,adaptive-param,True,True,COMPLETE
53,3.4824485778808594,2020-06-20 23:33:43.671830,2020-06-21 05:04:10.770741,0 days 05:30:27.098911000,256,0.999,0.0003671258476167644,10000,0.34695443454598107,adaptive-param,True,True,PRUNED
54,3.0869932174682617,2020-06-20 23:33:51.296352,2020-06-21 02:23:05.088406,0 days 02:49:13.792054000,64,0.95,0.0005312659309845871,10000,0.34938017725494036,adaptive-param,True,True,COMPLETE
55,1.5617667436599731,2020-06-20 23:34:33.048412,2020-06-21 06:17:36.759924,0 days 06:43:03.711512000,256,0.95,0.00026909132537528986,10000,0.329660663174721,adaptive-param,True,True,COMPLETE
56,2.556908369064331,2020-06-20 23:40:23.221831,2020-06-21 06:18:11.808951,0 days 06:37:48.587120000,256,0.95,0.00044891728161392094,10000,0.6082044187705395,adaptive-param,True,True,COMPLETE
57,0.8221179842948914,2020-06-20 23:40:43.169530,2020-06-21 06:15:21.663459,0 days 06:34:38.493929000,256,0.9999,0.00042135897062473124,10000,0.6060595303615914,ornstein-uhlenbeck,True,True,COMPLETE
58,2.676243543624878,2020-06-20 23:54:25.439175,2020-06-21 01:19:43.900463,0 days 01:25:18.461288000,16,0.9999,0.0004852270011308752,10000,0.252387135453854,ornstein-uhlenbeck,True,True,COMPLETE
59,3.442018985748291,2020-06-21 00:17:23.823279,2020-06-21 01:41:10.969105,0 days 01:23:47.145826000,16,0.9999,4.537057504224268e-05,10000,0.5791295888028546,ornstein-uhlenbeck,True,True,COMPLETE
60,8.95750617980957,2020-06-21 00:30:31.992856,2020-06-21 00:57:17.908281,0 days 00:26:45.915425000,16,0.95,0.005962925013712325,10000,0.2624331019645167,ornstein-uhlenbeck,True,True,PRUNED
61,0.8999101519584656,2020-06-21 00:43:29.911148,2020-06-21 03:25:56.254456,0 days 02:42:26.343308000,64,0.99,3.8888608820502446e-05,10000,0.6133646366019674,normal,True,True,COMPLETE
62,0.5518576502799988,2020-06-21 00:57:19.324230,2020-06-21 03:41:22.205486,0 days 02:44:02.881256000,64,0.99,4.4178600033370067e-05,10000,0.6202008516414005,ornstein-uhlenbeck,True,True,COMPLETE
63,0.34909915924072266,2020-06-21 00:58:05.930836,2020-06-21 03:41:46.115656,0 days 02:43:40.184820000,64,0.99,5.3620638564895167e-05,10000,0.68941851630933,ornstein-uhlenbeck,True,True,COMPLETE
64,1.5881901979446411,2020-06-21 00:58:30.114404,2020-06-21 03:41:14.482736,0 days 02:42:44.368332000,64,0.99,5.248372562962519e-05,10000,0.6108040880256915,ornstein-uhlenbeck,True,True,COMPLETE
65,2.799797534942627,2020-06-21 00:58:59.704222,2020-06-21 03:41:03.316360,0 days 02:42:03.612138000,64,0.99,3.4931601540896394e-05,10000,0.7020096992371421,ornstein-uhlenbeck,True,True,COMPLETE
66,5.1863579750061035,2020-06-21 01:07:02.768278,2020-06-21 01:59:58.429812,0 days 00:52:55.661534000,64,0.99,6.109555861660765e-05,10000,0.6573483318013136,ornstein-uhlenbeck,True,True,PRUNED
67,2.2337887287139893,2020-06-21 01:19:43.910906,2020-06-21 04:00:57.741977,0 days 02:41:13.831071000,64,0.99,5.91494160193907e-05,10000,0.6282201489816944,ornstein-uhlenbeck,True,True,COMPLETE
68,5.896073818206787,2020-06-21 01:27:13.802730,2020-06-21 02:20:55.205293,0 days 00:53:41.402563000,64,0.98,5.307922444628498e-05,10000,0.6269088852957259,normal,True,True,PRUNED
69,0.18012504279613495,2020-06-21 01:27:19.411582,2020-06-21 04:12:53.271980,0 days 02:45:33.860398000,64,0.98,0.0010561308249352115,100000,0.6404031783349042,normal,True,True,COMPLETE
70,0.950549304485321,2020-06-21 01:33:00.143895,2020-06-21 04:14:48.594548,0 days 02:41:48.450653000,64,0.98,7.73114708982776e-05,100000,0.6763756503367282,normal,True,True,COMPLETE
71,4.19737434387207,2020-06-21 01:39:05.695642,2020-06-21 02:32:42.292050,0 days 00:53:36.596408000,64,0.98,9.360410277878554e-05,100000,0.6645377612696964,normal,True,True,PRUNED
72,1.067076325416565,2020-06-21 01:41:10.982526,2020-06-21 04:23:56.544290,0 days 02:42:45.561764000,64,0.98,8.678712903103925e-05,100000,0.6658402178474767,normal,True,True,COMPLETE
73,3.1295106410980225,2020-06-21 01:56:57.643709,2020-06-21 02:50:05.521901,0 days 00:53:07.878192000,64,0.98,9.844389182720314e-05,100000,0.7111412376282852,normal,True,True,PRUNED
74,6.174837589263916,2020-06-21 02:00:00.052446,2020-06-21 02:52:54.132745,0 days 00:52:54.080299000,64,0.98,0.00014306911544965551,100000,0.682536563218628,normal,True,True,PRUNED
75,4.097836017608643,2020-06-21 02:20:56.963888,2020-06-21 03:14:43.866734,0 days 00:53:46.902846000,64,0.98,0.0001307858124440316,100000,0.7325804491430898,normal,True,True,PRUNED
76,1.205764651298523,2020-06-21 02:23:05.093924,2020-06-21 05:02:52.627808,0 days 02:39:47.533884000,64,0.98,0.0001513951832935,100000,0.7166442999900221,normal,True,True,COMPLETE
77,2.718763589859009,2020-06-21 02:27:33.926068,2020-06-21 03:21:16.156634,0 days 00:53:42.230566000,64,0.98,0.00020272788346827105,100000,0.722622856784943,normal,True,True,PRUNED
78,0.9383149147033691,2020-06-21 02:32:44.048882,2020-06-21 05:11:11.536832,0 days 02:38:27.487950000,64,0.98,2.7844387407807287e-05,100000,0.7335294506199352,normal,True,True,COMPLETE
79,0.43698397278785706,2020-06-21 02:50:06.984822,2020-06-21 05:22:58.371353,0 days 02:32:51.386531000,64,0.98,0.00024452284029788764,100000,0.7877433818034816,normal,True,True,COMPLETE
80,0.8748949766159058,2020-06-21 02:52:55.607071,2020-06-21 05:24:10.760626,0 days 02:31:15.153555000,64,0.98,0.0002736762662288282,100000,0.8077829718750427,normal,True,True,COMPLETE
81,1.1780602931976318,2020-06-21 03:09:52.141683,2020-06-21 05:36:19.092799,0 days 02:26:26.951116000,64,0.999,0.001693556629648798,100000,0.17627860317931704,normal,True,True,COMPLETE
82,0.956508994102478,2020-06-21 03:13:38.453176,2020-06-21 06:20:14.875951,0 days 03:06:36.422775000,128,0.999,0.0002846438933011151,100000,0.8148391362662792,adaptive-param,True,True,COMPLETE
83,2.8299152851104736,2020-06-21 03:14:45.652008,2020-06-21 06:21:00.006477,0 days 03:06:14.354469000,128,0.999,0.00025303808674698256,100000,0.7881192497516272,adaptive-param,True,True,COMPLETE
84,4.814392566680908,2020-06-21 03:21:17.976699,2020-06-21 04:52:26.502199,0 days 01:31:08.525500000,128,0.999,0.0018112185139519494,100000,0.8156769118126155,adaptive-param,True,True,PRUNED
85,4.981135368347168,2020-06-21 03:25:56.262876,2020-06-21 04:53:39.601913,0 days 01:27:43.339037000,128,0.999,2.755512970212215e-05,100000,0.8155215521283538,normal,True,True,PRUNED
86,0.7056601643562317,2020-06-21 03:41:03.331533,2020-06-21 06:22:22.192717,0 days 02:41:18.861184000,128,0.999,0.000300774709546748,100000,0.8122449743686614,normal,True,True,COMPLETE
87,1.5606626272201538,2020-06-21 03:41:14.492599,2020-06-21 05:16:26.960052,0 days 01:35:12.467453000,128,0.999,0.00029608547439971685,100000,0.7810030828875933,normal,True,True,PRUNED
88,0.5171321630477905,2020-06-21 03:41:22.217402,2020-06-21 05:52:06.641942,0 days 02:10:44.424540000,64,0.9,2.635849939625635e-05,10000,0.7958061851773559,normal,True,True,COMPLETE
89,1.4998151063919067,2020-06-21 03:41:46.122160,2020-06-21 05:53:03.412845,0 days 02:11:17.290685000,64,0.9,0.000288007121941055,10000,0.7978466467170149,ornstein-uhlenbeck,True,True,COMPLETE
90,2.389775276184082,2020-06-21 04:00:57.763966,2020-06-21 04:53:12.237434,0 days 00:52:14.473468000,64,0.9,0.000274235162797814,10000,0.7647979694715178,ornstein-uhlenbeck,True,True,PRUNED
91,1.4451826810836792,2020-06-21 04:12:53.285947,2020-06-21 06:06:00.628179,0 days 01:53:07.342232000,64,0.98,0.00026518325412669224,100000,0.7837194808151986,normal,True,True,COMPLETE
92,8.555625915527344,2020-06-21 04:14:48.612151,2020-06-21 05:07:00.113917,0 days 00:52:11.501766000,64,0.98,0.0018316246883665584,100000,0.8043541960513962,ornstein-uhlenbeck,True,True,PRUNED
93,4.4275383949279785,2020-06-21 04:15:05.869381,2020-06-21 05:06:37.721412,0 days 00:51:31.852031000,64,0.9,0.0002850436941222909,100000,0.7927176761529906,ornstein-uhlenbeck,True,True,PRUNED
94,0.8644453883171082,2020-06-21 04:17:05.047862,2020-06-21 06:39:19.923244,0 days 02:22:14.875382000,256,0.9,0.00026849736155956986,100000,0.7928600779270124,ornstein-uhlenbeck,True,True,COMPLETE
95,1.7390838861465454,2020-06-21 04:17:39.226590,2020-06-21 06:40:25.456286,0 days 02:22:46.229696000,256,0.9,0.0016809864864244098,100000,0.7727416773046532,ornstein-uhlenbeck,True,True,COMPLETE
96,1.2012825012207031,2020-06-21 04:23:56.557316,2020-06-21 06:40:33.595419,0 days 02:16:37.038103000,256,0.9,0.00027924914719595033,100000,0.82923915189888,ornstein-uhlenbeck,True,True,COMPLETE
97,1.3003333806991577,2020-06-21 04:38:16.851512,2020-06-21 06:41:52.459278,0 days 02:03:35.607766000,256,0.9,0.0009301891779394479,1000000,0.7950765912319926,adaptive-param,True,False,COMPLETE
98,1.7219593524932861,2020-06-21 04:52:28.537168,2020-06-21 06:42:10.517330,0 days 01:49:41.980162000,256,0.9999,0.0008540340402841995,1000000,0.7645764569815026,adaptive-param,True,False,COMPLETE
99,2.0627379417419434,2020-06-21 04:53:13.914378,2020-06-21 06:21:03.822280,0 days 01:27:49.907902000,256,0.9999,0.0007462833022765247,1000000,0.8089946179788754,adaptive-param,True,False,PRUNED
