number,value,datetime_start,datetime_complete,duration,params_batch_size,params_buffer_size,params_gamma,params_lr,params_n_sampled_goal,params_noise_std,params_noise_type,params_random_exploration,params_train_freq,state
0,8.428422927856445,2020-06-27 14:30:25.962396,2020-06-27 17:24:13.377008,0 days 02:53:47.414612000,32,1000000,0.9999,0.06299187350651982,2,0.6095304929977196,normal,0.1754551202569843,1,COMPLETE
1,1.6414072513580322,2020-06-27 14:30:25.962839,2020-06-28 03:14:18.640797,0 days 12:43:52.677958000,256,1000000,0.995,0.031707569310706805,1,0.4820703574231834,normal,0.48865410730095626,1,COMPLETE
2,1.641275405883789,2020-06-27 14:30:25.963151,2020-06-27 19:07:05.143093,0 days 04:36:39.179942000,64,10000,0.999,3.2510125717598704e-05,4,0.7395862974756885,ornstein-uhlenbeck,0.5136860435881286,2000,COMPLETE
3,3.4476304054260254,2020-06-27 14:30:25.963424,2020-06-28 04:20:09.758818,0 days 13:49:43.795394000,256,1000000,0.95,0.0011329533728258248,8,0.09244908326104684,ornstein-uhlenbeck,0.034148019073707236,1000,COMPLETE
4,8.428411483764648,2020-06-27 14:30:25.963709,2020-06-27 21:23:36.342303,0 days 06:53:10.378594000,100,100000,0.999,0.004152496500056225,8,0.7030352361069573,normal,0.4804203438079563,10,COMPLETE
5,1.6411449909210205,2020-06-27 14:30:25.964908,2020-06-27 17:36:37.750662,0 days 03:06:11.785754000,32,1000000,0.9999,5.130091403146033e-05,4,0.6884316673580115,ornstein-uhlenbeck,0.9179670027930694,10,COMPLETE
6,8.428422927856445,2020-06-27 14:30:25.965191,2020-06-27 17:12:48.897651,0 days 02:42:22.932460000,32,100000,0.995,0.09643656042993784,1,0.46841928836230684,normal,0.30121810737577404,10,COMPLETE
7,7.854564666748047,2020-06-27 14:30:25.965462,2020-06-28 13:20:01.426578,0 days 22:49:35.461116000,512,1000000,0.999,0.0001191728943461185,4,0.9976503612875093,normal,0.3455692544005684,100,COMPLETE
8,8.428422927856445,2020-06-27 14:30:25.965720,2020-06-27 17:38:56.926129,0 days 03:08:30.960409000,100,100000,0.95,0.01853932253842054,2,0.2834168230827129,ornstein-uhlenbeck,0.531266162976831,2000,PRUNED
9,8.428422927856445,2020-06-27 14:30:25.965968,2020-06-27 17:35:29.472573,0 days 03:05:03.506605000,100,1000000,0.99,0.137639769870851,1,0.24626917813493543,ornstein-uhlenbeck,0.46285045751857623,1,PRUNED
10,1.6414072513580322,2020-06-27 14:30:25.966230,2020-06-27 20:58:05.738189,0 days 06:27:39.771959000,100,10000,0.999,0.0015313452220858965,6,0.8828154743384977,normal,0.9383917748929902,2000,COMPLETE
11,8.428422927856445,2020-06-27 14:30:25.966517,2020-06-27 17:31:37.125627,0 days 03:01:11.159110000,32,10000,0.999,0.03225949251896458,8,0.7932758739713487,ornstein-uhlenbeck,0.052561185792044274,10,PRUNED
12,8.279950141906738,2020-06-27 14:30:25.966766,2020-06-27 17:43:56.914878,0 days 03:13:30.948112000,128,100000,0.999,1.3788298627147715e-05,4,0.3132319139885823,ornstein-uhlenbeck,0.47820500139736233,100,PRUNED
13,8.428422927856445,2020-06-27 14:30:25.967022,2020-06-27 17:20:11.471873,0 days 02:49:45.504851000,32,1000000,0.98,0.2569547673072696,2,0.15674978176347576,normal,0.7233211250302379,1,COMPLETE
14,2.4071412086486816,2020-06-27 14:30:25.967282,2020-06-28 03:54:26.616002,0 days 13:24:00.648720000,256,100000,0.99,0.0003655402316468839,6,0.747807174621498,normal,0.2868275957900055,2000,COMPLETE
15,1.6413856744766235,2020-06-27 14:30:25.967577,2020-06-27 18:43:15.141234,0 days 04:12:49.173657000,64,1000000,0.9,0.00334017374985409,1,0.22735945976190808,ornstein-uhlenbeck,0.9997231115717791,2000,COMPLETE
16,1.6414072513580322,2020-06-27 14:30:25.967850,2020-06-27 17:07:51.675061,0 days 02:37:25.707211000,16,100000,0.98,0.8857810927088174,6,0.46145263299864325,normal,0.23787524028519913,10,COMPLETE
17,0.2664170265197754,2020-06-27 14:30:25.968106,2020-06-27 21:54:07.944248,0 days 07:23:41.976142000,128,10000,0.9999,2.465617656214891e-05,4,0.9088912514650789,normal,0.5533817222350345,1,COMPLETE
18,1.6414072513580322,2020-06-27 14:30:25.968391,2020-06-27 20:36:49.618680,0 days 06:06:23.650289000,100,100000,0.95,0.11841159754701464,2,0.8801734815571629,ornstein-uhlenbeck,0.028961513620635815,1,COMPLETE
19,1.6369311809539795,2020-06-27 14:30:25.968651,2020-06-27 19:35:21.341805,0 days 05:04:55.373154000,64,10000,0.999,2.322976923716219e-05,8,0.3415355077979443,normal,0.5989411483317958,10,COMPLETE
20,1.6414072513580322,2020-06-27 14:30:25.968945,2020-06-27 21:43:06.115614,0 days 07:12:40.146669000,128,10000,0.98,0.017092929382852066,2,0.15861032825477261,ornstein-uhlenbeck,0.5333776026773561,2000,COMPLETE
21,3.0007197856903076,2020-06-27 14:30:25.969229,2020-06-27 21:28:17.756930,0 days 06:57:51.787701000,128,10000,0.9999,0.0009982190478938463,1,0.8542630890869426,ornstein-uhlenbeck,0.9764150960711532,1,COMPLETE
22,1.055300235748291,2020-06-27 14:30:25.969546,2020-06-28 14:25:35.097091,0 days 23:55:09.127545000,512,1000000,0.99,8.254420348675142e-05,8,0.9569308191015726,ornstein-uhlenbeck,0.28883725763839196,1000,COMPLETE
23,1.714159369468689,2020-06-27 14:30:25.969815,2020-06-27 16:48:28.989904,0 days 02:18:03.020089000,16,1000000,0.9,1.201679505730335e-05,4,0.24060368705872448,normal,0.08551941674260988,10,COMPLETE
24,1.6384086608886719,2020-06-27 14:30:25.970184,2020-06-27 20:59:08.366762,0 days 06:28:42.396578000,100,10000,0.95,1.94404416491949e-05,6,0.8028577452604787,ornstein-uhlenbeck,0.06831471803003886,10,COMPLETE
25,1.6414072513580322,2020-06-27 14:30:25.970502,2020-06-27 17:20:21.071374,0 days 02:49:55.100872000,32,1000000,0.9,0.2886573049200034,2,0.26813152400859086,ornstein-uhlenbeck,0.7682298614769737,1000,COMPLETE
26,1.691425085067749,2020-06-27 14:30:25.971158,2020-06-27 19:12:47.337279,0 days 04:42:21.366121000,64,1000000,0.95,1.4891136234344046e-05,4,0.8113477770373754,normal,0.12752077727160227,10,COMPLETE
27,0.3484145998954773,2020-06-27 14:30:25.971521,2020-06-27 17:19:43.424958,0 days 02:49:17.453437000,16,1000000,0.995,3.387408322293556e-05,8,0.1426194572701428,normal,0.7968121806946269,100,COMPLETE
28,1.6414072513580322,2020-06-27 14:30:25.971811,2020-06-27 17:18:22.739869,0 days 02:47:56.768058000,16,10000,0.995,0.0007474585102164698,8,0.5665516544401337,normal,0.9642363372261546,1,COMPLETE
29,1.6414072513580322,2020-06-27 14:30:25.972189,2020-06-27 17:17:44.030638,0 days 02:47:18.058449000,32,10000,0.95,0.018338673951409593,2,0.14455445554843793,ornstein-uhlenbeck,0.6670112477965466,10,COMPLETE
30,1.6414072513580322,2020-06-27 14:30:25.973084,2020-06-27 17:03:52.677268,0 days 02:33:26.704184000,16,1000000,0.98,0.055722062895074066,6,0.03302979421655439,normal,0.5986240274592507,10,COMPLETE
31,8.428422927856445,2020-06-27 14:30:25.973448,2020-06-27 19:11:50.473926,0 days 04:41:24.500478000,64,100000,0.9999,0.004096039656634416,4,0.537709251340856,ornstein-uhlenbeck,0.860880212228081,1,COMPLETE
32,8.428422927856445,2020-06-27 16:48:29.062792,2020-06-27 21:37:00.618807,0 days 04:48:31.556015000,256,1000000,0.99,0.044821370317562864,2,0.6084617004703103,normal,0.42510431473313415,1,PRUNED
33,0.42588701844215393,2020-06-27 17:03:52.743792,2020-06-27 21:11:39.716129,0 days 04:07:46.972337000,64,1000000,0.98,0.004240962366825746,2,0.20460880507629475,normal,0.041145117541307785,10,COMPLETE
34,0.8385778665542603,2020-06-27 17:07:51.709706,2020-06-28 06:12:38.414047,0 days 13:04:46.704341000,256,1000000,0.98,2.8622851003283838e-05,8,0.6424894823690233,normal,0.6874913339904342,100,COMPLETE
35,8.247649192810059,2020-06-27 17:12:48.909902,2020-06-27 18:02:12.409999,0 days 00:49:23.500097000,32,100000,0.9999,3.18565672449031e-05,1,0.4842664821738647,normal,0.05954724869735517,1000,PRUNED
36,2.44389271736145,2020-06-27 17:17:44.034513,2020-06-28 15:55:49.847297,0 days 22:38:05.812784000,512,1000000,0.95,3.7573233820783544e-05,2,0.6253749629404903,ornstein-uhlenbeck,0.34525761352668716,10,COMPLETE
37,8.18055534362793,2020-06-27 17:18:22.749300,2020-06-28 05:43:46.690855,0 days 12:25:23.941555000,256,1000000,0.995,2.9653347942838718e-05,1,0.19305039645010014,ornstein-uhlenbeck,0.9897529893542477,100,COMPLETE
38,1.6414072513580322,2020-06-27 17:19:43.562067,2020-06-27 19:59:35.976077,0 days 02:39:52.414010000,32,10000,0.999,0.005362537094560474,4,0.798215252225408,ornstein-uhlenbeck,0.3311088383730336,2000,COMPLETE
39,2.9919192790985107,2020-06-27 17:20:11.492359,2020-06-27 19:24:24.886665,0 days 02:04:13.394306000,100,100000,0.9,0.004039388666239456,2,0.3544969859284838,normal,0.5869281907803785,1,PRUNED
40,8.471331596374512,2020-06-27 17:20:21.109355,2020-06-28 00:48:13.713993,0 days 07:27:52.604638000,128,1000000,0.995,2.2817313899675684e-05,8,0.6046242763800197,ornstein-uhlenbeck,0.8216044702868852,2000,COMPLETE
41,8.426085472106934,2020-06-27 17:24:13.399014,2020-06-27 23:41:32.315989,0 days 06:17:18.916975000,100,100000,0.999,1.0382919825567517e-05,8,0.9079094265580553,ornstein-uhlenbeck,0.9790474414487293,100,COMPLETE
42,8.568574905395508,2020-06-27 17:31:38.562985,2020-06-28 06:22:25.306782,0 days 12:50:46.743797000,256,100000,0.99,1.5199672459703293e-05,6,0.39858266854544855,normal,0.3994532997908722,100,COMPLETE
43,0.6913747191429138,2020-06-27 17:35:31.182703,2020-06-28 06:10:30.499786,0 days 12:34:59.317083000,256,100000,0.995,1.570383573611711e-05,6,0.4218265649692172,normal,0.9320969022998635,100,COMPLETE
44,8.407119750976562,2020-06-27 17:36:37.767195,2020-06-28 00:39:25.581852,0 days 07:02:47.814657000,128,1000000,0.9999,1.5702896122943235e-05,4,0.9966449047402403,ornstein-uhlenbeck,0.9667188873482755,100,COMPLETE
45,1.6414047479629517,2020-06-27 17:38:58.576942,2020-06-27 21:41:43.104528,0 days 04:02:44.527586000,64,1000000,0.9999,1.4869440214173917e-05,4,0.86315614753836,ornstein-uhlenbeck,0.9992004779880952,100,COMPLETE
46,1.303495168685913,2020-06-27 17:43:58.728519,2020-06-28 06:34:32.883544,0 days 12:50:34.155025000,256,1000000,0.9999,0.00019098998674091106,8,0.9530385356936732,ornstein-uhlenbeck,0.9820328942830244,100,COMPLETE
47,1.6414072513580322,2020-06-27 18:02:14.042378,2020-06-28 06:36:40.575480,0 days 12:34:26.533102000,256,1000000,0.995,0.00013273537556422543,8,0.963857047859115,ornstein-uhlenbeck,0.9965162083994039,100,COMPLETE
48,0.6745667457580566,2020-06-27 18:43:15.160178,2020-06-28 16:47:43.224686,0 days 22:04:28.064508000,512,1000000,0.9999,0.0001105925291460742,4,0.9665644088569978,ornstein-uhlenbeck,0.8711931892370252,100,COMPLETE
49,8.381688117980957,2020-06-27 19:07:05.146668,2020-06-28 17:38:20.919811,0 days 22:31:15.773143000,512,1000000,0.9999,0.0002065950892767674,8,0.9603916577036502,normal,0.8596871775114108,100,COMPLETE
50,4.736826419830322,2020-06-27 19:11:50.479874,2020-06-28 18:14:10.030001,0 days 23:02:19.550127000,512,1000000,0.995,0.00021088555142171342,8,0.9827798758539537,normal,0.8874321962633535,100,COMPLETE
51,5.1500444412231445,2020-06-27 19:12:47.373401,2020-06-28 17:29:52.494313,0 days 22:17:05.120912000,512,1000000,0.995,0.00021074614004134814,8,0.6823191472523525,ornstein-uhlenbeck,0.8845788089852895,100,COMPLETE
52,3.043911933898926,2020-06-27 19:24:26.642603,2020-06-28 17:55:41.968798,0 days 22:31:15.326195000,512,10000,0.995,0.00011409793554224551,8,0.7173845850717981,ornstein-uhlenbeck,0.8769146562358405,100,COMPLETE
53,6.215160369873047,2020-06-27 19:35:21.346754,2020-06-27 23:55:14.756318,0 days 04:19:53.409564000,256,10000,0.995,0.00017036485145175464,8,0.938959087821123,normal,0.8798390661829214,100,PRUNED
54,8.2235746383667,2020-06-27 19:59:35.981672,2020-06-28 08:34:58.760274,0 days 12:35:22.778602000,256,1000000,0.995,0.00020596298910048255,8,0.9863392653155856,normal,0.8771026329916076,100,COMPLETE
55,3.1696605682373047,2020-06-27 20:36:49.627876,2020-06-28 19:29:51.121293,0 days 22:53:01.493417000,512,1000000,0.995,0.0001924446916984349,8,0.013554971559523149,normal,0.8774661662053282,100,COMPLETE
56,4.763373851776123,2020-06-27 20:58:05.744728,2020-06-28 09:15:16.575445,0 days 12:17:10.830717000,256,1000000,0.995,0.00018579848480885554,8,0.0038460131944148546,normal,0.8051461265665709,100,COMPLETE
57,8.612443923950195,2020-06-27 20:59:08.369148,2020-06-28 19:09:41.209249,0 days 22:10:32.840101000,512,10000,0.995,0.00016197631253359453,8,0.054156511228607984,normal,0.8130720781735218,100,COMPLETE
58,8.428060531616211,2020-06-27 21:11:39.735644,2020-06-28 09:43:13.273687,0 days 12:31:33.538043000,256,1000000,0.995,0.00017403220934548598,8,0.04042658579136332,normal,0.8222233796589116,100,COMPLETE
59,2.619960308074951,2020-06-27 21:23:36.358619,2020-06-28 01:37:57.644158,0 days 04:14:21.285539000,256,1000000,0.995,0.00016707640391902377,8,0.01202657314377642,normal,0.8350707903759118,100,PRUNED
60,7.262824058532715,2020-06-27 21:28:17.764275,2020-06-28 09:47:18.203755,0 days 12:19:00.439480000,256,1000000,0.995,0.00023556445117237608,8,0.010877060289061102,normal,0.8239810561703979,100,COMPLETE
61,2.0725133419036865,2020-06-27 21:37:02.722092,2020-06-28 19:24:44.961512,0 days 21:47:42.239420000,512,1000000,0.995,0.00021490516714707357,8,0.0021593613806891176,normal,0.8235054093548392,100,COMPLETE
62,8.428422927856445,2020-06-27 21:41:43.119068,2020-06-28 19:48:36.417132,0 days 22:06:53.298064000,512,10000,0.995,0.00019426560624551584,8,0.00890888497911052,normal,0.8171798305923527,100,COMPLETE
63,8.383783340454102,2020-06-27 21:43:06.118764,2020-06-28 19:41:45.312171,0 days 21:58:39.193407000,512,10000,0.995,0.0003402709947651871,8,0.9861070784511974,normal,0.8219940113729374,100,COMPLETE
64,0.2917526662349701,2020-06-27 21:54:07.949829,2020-06-28 19:33:33.695296,0 days 21:39:25.745467000,512,10000,0.995,0.00014780992365971503,8,0.013256170393516703,normal,0.8049702286147908,100,COMPLETE
65,3.3579776287078857,2020-06-27 23:41:32.348066,2020-06-28 22:17:04.817717,0 days 22:35:32.469651000,512,10000,0.995,0.00011213800104635464,8,0.3904911062611327,normal,0.8133553207978125,100,COMPLETE
66,0.6063508987426758,2020-06-27 23:55:16.648955,2020-06-28 21:59:43.205071,0 days 22:04:26.556116000,512,10000,0.995,0.0001404316186817815,8,0.06038856556334107,normal,0.790690292725551,100,COMPLETE
67,0.9305828213691711,2020-06-28 00:39:25.632639,2020-06-28 22:33:39.942419,0 days 21:54:14.309780000,512,10000,0.995,0.00012119128090444413,8,0.025109418993047625,normal,0.788943340772267,1000,COMPLETE
68,1.6414072513580322,2020-06-28 00:48:13.730344,2020-06-28 22:33:54.048435,0 days 21:45:40.318091000,512,10000,0.995,9.033826427851383e-05,8,0.054065506079727765,normal,0.39711193149601676,100,COMPLETE
69,8.414267539978027,2020-06-28 01:38:00.210687,2020-06-28 23:26:53.211709,0 days 21:48:53.001022000,512,10000,0.98,7.540396709722078e-05,8,0.4000046534149229,normal,0.3921137618715643,1000,COMPLETE
70,0.30339375138282776,2020-06-28 03:14:18.652093,2020-06-29 00:08:20.766361,0 days 20:54:02.114268000,512,10000,0.98,9.22743330546913e-05,8,0.10168745317610153,normal,0.41187659286216083,1000,COMPLETE
71,1.6360104084014893,2020-06-28 03:54:26.631681,2020-06-29 00:27:41.370168,0 days 20:33:14.738487000,512,10000,0.98,5.427911227645857e-05,8,0.3946148521501566,normal,0.3936726688499299,1000,COMPLETE
72,2.161693572998047,2020-06-28 04:20:09.783973,2020-06-29 00:45:22.714709,0 days 20:25:12.930736000,512,10000,0.98,6.85347647330156e-05,6,0.35611437337288354,normal,0.39561842700523076,10,COMPLETE
73,3.7111849784851074,2020-06-28 05:43:46.708806,2020-06-29 01:01:38.283658,0 days 19:17:51.574852000,512,10000,0.95,6.486397282904592e-05,6,0.40939202244416995,normal,0.6595275373076536,10,COMPLETE
74,8.434966087341309,2020-06-28 06:10:30.506958,2020-06-29 01:21:33.785000,0 days 19:11:03.278042000,512,10000,0.995,7.368760975244649e-05,8,0.4139114979747162,normal,0.6822520467478537,100,COMPLETE
75,1.3409618139266968,2020-06-28 06:12:38.724364,2020-06-29 01:29:10.750713,0 days 19:16:32.026349000,512,1000000,0.98,7.123278287157982e-05,8,0.08431057559155716,normal,0.6948257370228978,100,COMPLETE
76,8.308199882507324,2020-06-28 06:22:25.318627,2020-06-28 14:01:54.370334,0 days 07:39:29.051707000,512,1000000,0.98,6.926598179291131e-05,8,0.0875064845780873,normal,0.6888717435445301,100,PRUNED
77,3.1451315879821777,2020-06-28 06:34:32.925810,2020-06-29 02:00:07.200580,0 days 19:25:34.274770000,512,1000000,0.98,6.209063970618913e-05,8,0.0832409028058757,normal,0.6957365590622266,100,COMPLETE
78,1.5242960453033447,2020-06-28 06:36:40.592042,2020-06-29 01:37:24.790257,0 days 19:00:44.198215000,512,1000000,0.98,7.003972740090643e-05,6,0.08753166126539685,normal,0.7047253156203841,100,COMPLETE
79,2.8103837966918945,2020-06-28 08:34:58.775896,2020-06-29 02:07:17.254622,0 days 17:32:18.478726000,512,1000000,0.98,6.366892560927068e-05,6,0.061402775829052486,normal,0.651955015828907,100,COMPLETE
80,1.8848520517349243,2020-06-28 09:15:16.600246,2020-06-29 02:24:31.306777,0 days 17:09:14.706531000,512,1000000,0.98,5.5681761095612516e-05,6,0.6606183520357822,normal,0.6665113836327329,100,COMPLETE
81,7.9737868309021,2020-06-28 09:43:13.310005,2020-06-29 02:21:28.132617,0 days 16:38:14.822612000,512,1000000,0.98,6.174546726876086e-05,6,0.6744236699035152,normal,0.6613742228176979,1000,COMPLETE
82,8.31104564666748,2020-06-28 09:47:18.250254,2020-06-29 02:30:08.499377,0 days 16:42:50.249123000,512,1000000,0.98,9.109059837838854e-05,6,0.690290970755751,normal,0.7359848550024175,100,COMPLETE
83,3.2422897815704346,2020-06-28 13:20:01.438530,2020-06-29 02:47:46.314388,0 days 13:27:44.875858000,512,1000000,0.98,6.867545828607767e-05,6,0.6610972556081769,normal,0.705126157833979,100,COMPLETE
84,4.586335182189941,2020-06-28 14:01:57.246208,2020-06-29 02:56:04.583288,0 days 12:54:07.337080000,512,1000000,0.98,6.0910653133852955e-05,6,0.6817126951971213,normal,0.9131343435656007,100,COMPLETE
85,3.26715087890625,2020-06-28 14:25:35.119971,2020-06-29 02:55:17.913717,0 days 12:29:42.793746000,512,1000000,0.98,6.617026429638375e-05,6,0.7203411282856043,normal,0.6502796290900013,1000,COMPLETE
86,3.187180757522583,2020-06-28 15:55:49.864096,2020-06-29 03:00:38.428805,0 days 11:04:48.564709000,512,1000000,0.98,6.741472292582549e-05,6,0.41629796924266443,normal,0.6596322519093203,1000,COMPLETE
87,2.0411758422851562,2020-06-28 16:47:43.235913,2020-06-29 03:00:06.317947,0 days 10:12:23.082034000,512,1000000,0.98,0.007204576203650101,4,0.41964025751711065,normal,0.745350372315619,100,COMPLETE
88,8.480514526367188,2020-06-28 17:29:52.511525,2020-06-28 19:00:44.903754,0 days 01:30:52.392229000,16,100000,0.98,5.121092644463058e-05,4,0.10114924371344347,normal,0.7321274689204622,100,COMPLETE
89,8.218585014343262,2020-06-28 17:38:20.970246,2020-06-28 18:10:12.391012,0 days 00:31:51.420766000,16,10000,0.98,6.262728591349047e-05,4,0.41221962654646227,normal,0.9215159052138098,100,PRUNED
90,1.6377032995224,2020-06-28 17:55:41.976339,2020-06-28 19:26:58.669988,0 days 01:31:16.693649000,16,100000,0.98,5.52639817909821e-05,4,0.417650369251388,normal,0.7542866701607577,1,COMPLETE
91,8.31235408782959,2020-06-28 18:10:13.981154,2020-06-28 23:52:33.337706,0 days 05:42:19.356552000,128,100000,0.98,4.32370953009114e-05,6,0.12146327984439276,normal,0.7520878040562884,1,COMPLETE
92,1.6658179759979248,2020-06-28 18:14:10.293863,2020-06-29 03:01:37.147055,0 days 08:47:26.853192000,512,1000000,0.98,0.0019218277556459916,6,0.08382555210396338,normal,0.7610818143629374,1000,COMPLETE
93,2.5094151496887207,2020-06-28 19:00:44.935529,2020-06-29 00:26:06.223682,0 days 05:25:21.288153000,128,1000000,0.99,0.009108003935413915,6,0.29147070617421966,normal,0.19776241842281395,1000,COMPLETE
94,8.34750747680664,2020-06-28 19:09:41.213605,2020-06-29 00:39:48.491163,0 days 05:30:07.277558000,128,1000000,0.99,0.0018056165301379324,6,0.9164837107940524,normal,0.23453008267258252,1000,COMPLETE
95,8.428422927856445,2020-06-28 19:24:44.975918,2020-06-29 00:40:43.172918,0 days 05:15:58.197000000,128,1000000,0.99,0.01094273917468213,6,0.9059256729111236,normal,0.6340885037548211,1000,COMPLETE
96,8.428422927856445,2020-06-28 19:26:58.684268,2020-06-29 00:48:35.825614,0 days 05:21:37.141346000,128,1000000,0.99,0.009778524780242057,6,0.9199596359288209,normal,0.19709039317342128,1000,COMPLETE
97,8.428414344787598,2020-06-28 19:29:51.128121,2020-06-29 00:48:32.229253,0 days 05:18:41.101132000,128,1000000,0.99,0.0018538113448969228,6,0.9130923701386695,normal,0.22322812618906313,1000,COMPLETE
98,1.6414072513580322,2020-06-28 19:33:33.701974,2020-06-28 22:55:49.365230,0 days 03:22:15.663256000,64,10000,0.98,0.008888567954553983,6,0.19660114924811467,normal,0.669239483028005,1000,COMPLETE
99,4.368719577789307,2020-06-28 19:41:45.317111,2020-06-28 21:46:47.652330,0 days 02:05:02.335219000,128,10000,0.98,0.007335392472356458,6,0.18714583279534575,normal,0.6637485580402618,1000,PRUNED
