number,value,datetime_start,datetime_complete,duration,params_ent_coef,params_gamma,params_lr,params_lr_schedule,params_n_steps,params_vf_coef,state
0,0.38985326886177063,2020-06-20 19:15:21.305723,2020-06-20 19:38:51.781657,0 days 00:23:30.475934000,5.000279481233831e-05,0.95,0.001979033875570898,constant,512,0.5268168849908796,COMPLETE
1,0.31300243735313416,2020-06-20 19:15:21.307641,2020-06-20 19:39:04.401771,0 days 00:23:43.094130000,5.311439634015972e-06,0.9999,0.010945434116606005,linear,128,0.30220424718697425,COMPLETE
2,0.12749691307544708,2020-06-20 19:15:21.309269,2020-06-20 19:39:21.343209,0 days 00:24:00.033940000,4.675966676588504e-06,0.9999,2.6481434034790655e-05,linear,32,0.08033789685230008,COMPLETE
3,0.3760848343372345,2020-06-20 19:15:21.310882,2020-06-20 19:38:51.465540,0 days 00:23:30.154658000,0.0018278884300652902,0.9999,0.0005150929187684341,constant,2048,0.3064213714118531,COMPLETE
4,3.59576416015625,2020-06-20 19:15:21.312481,2020-06-20 19:39:23.633784,0 days 00:24:02.321303000,0.09226103031845183,0.99,0.0033270133091031096,constant,32,0.05145088057121916,COMPLETE
5,0.36730676889419556,2020-06-20 19:15:21.314016,2020-06-20 19:38:34.326102,0 days 00:23:13.012086000,0.05179198249666792,0.995,0.0239597493777495,linear,2048,0.5667942467348736,COMPLETE
6,0.16185465455055237,2020-06-20 19:15:21.315603,2020-06-20 19:39:19.042712,0 days 00:23:57.727109000,0.00035458774550859855,0.995,8.214710005610581e-05,constant,64,0.8265072521517658,COMPLETE
7,2.7937874794006348,2020-06-20 19:15:21.317306,2020-06-20 19:39:21.441478,0 days 00:24:00.124172000,0.00011138619583437775,0.995,0.0011241129864593086,constant,32,0.5320017450544937,COMPLETE
8,0.400786817073822,2020-06-20 19:15:21.318855,2020-06-20 19:38:40.560293,0 days 00:23:19.241438000,0.004203854610400656,0.999,0.02520559249772795,linear,512,0.3250038985859526,COMPLETE
9,2.535429000854492,2020-06-20 19:15:21.320466,2020-06-20 19:39:31.185328,0 days 00:24:09.864862000,1.090602066766713e-06,0.9999,0.003117543872751767,constant,64,0.7882345325204403,COMPLETE
10,0.9288141131401062,2020-06-20 19:15:21.322128,2020-06-20 19:38:51.943103,0 days 00:23:30.620975000,0.013455624262508105,0.995,1.565395335751328e-05,linear,256,0.8920212342770198,COMPLETE
11,0.32780012488365173,2020-06-20 19:15:21.323659,2020-06-20 19:38:34.379229,0 days 00:23:13.055570000,1.9085252435234425e-07,0.9999,0.01020830940575335,linear,1024,0.5313996902396644,COMPLETE
12,0.34934020042419434,2020-06-20 19:15:21.325229,2020-06-20 19:39:29.942825,0 days 00:24:08.617596000,0.012840595110757488,0.99,0.0002324725878677718,constant,32,0.4931273659106953,COMPLETE
13,1.3320306539535522,2020-06-20 19:15:21.326889,2020-06-20 19:38:49.543591,0 days 00:23:28.216702000,0.00022478167991387473,0.995,0.0007893729096768674,linear,256,0.2875879701360914,COMPLETE
14,0.4200301170349121,2020-06-20 19:15:21.328610,2020-06-20 19:39:26.744791,0 days 00:24:05.416181000,1.6818166139761644e-05,0.9999,6.645895191926278e-05,constant,32,0.5090098722136226,COMPLETE
15,0.378788560628891,2020-06-20 19:15:21.330238,2020-06-20 19:38:58.214013,0 days 00:23:36.883775000,1.1917428907175102e-07,0.999,1.5220518343683138e-05,linear,256,0.8536274223342646,COMPLETE
16,0.6236645579338074,2020-06-20 19:15:21.331970,2020-06-20 19:39:07.743027,0 days 00:23:46.411057000,0.00038510224601375,0.9999,2.1105043563973875e-05,constant,64,0.40214386667283986,COMPLETE
17,0.8307713270187378,2020-06-20 19:15:21.333588,2020-06-20 19:38:56.786106,0 days 00:23:35.452518000,7.470797075805172e-05,0.99,0.017403144772534632,linear,1024,0.9583256013898704,COMPLETE
18,0.4102321267127991,2020-06-20 19:15:21.335198,2020-06-20 19:38:46.883682,0 days 00:23:25.548484000,0.001595668223259031,0.995,0.49471759321762243,constant,2048,0.21972622767049643,COMPLETE
19,0.34445589780807495,2020-06-20 19:15:21.337034,2020-06-20 19:39:13.684287,0 days 00:23:52.347253000,5.996370746095742e-08,0.9,0.0009389391425609094,linear,256,0.3347173062665263,COMPLETE
20,0.803831934928894,2020-06-20 19:15:21.338708,2020-06-20 19:38:51.470631,0 days 00:23:30.131923000,2.176830953883924e-08,0.9999,4.419050883012191e-05,linear,256,0.7231062385428324,COMPLETE
21,0.23641641438007355,2020-06-20 19:15:21.340312,2020-06-20 19:39:17.567344,0 days 00:23:56.227032000,2.086614356167955e-05,0.9,0.00044099147262281605,constant,32,0.5284359356782264,COMPLETE
22,0.4701623022556305,2020-06-20 19:15:21.342196,2020-06-20 19:39:34.461058,0 days 00:24:13.118862000,0.0016265719605908328,0.98,3.468545111766232e-05,linear,16,0.6560660809922333,COMPLETE
23,1.697176218032837,2020-06-20 19:15:21.343858,2020-06-20 19:38:50.468155,0 days 00:23:29.124297000,0.0006390068960413191,0.999,4.155202798941931e-05,linear,512,0.13038863386131194,COMPLETE
24,0.6363956928253174,2020-06-20 19:15:21.345504,2020-06-20 19:38:46.702664,0 days 00:23:25.357160000,0.08241004457682752,0.9999,0.3999217646441251,constant,512,0.502230959745842,COMPLETE
25,0.31960025429725647,2020-06-20 19:15:21.347197,2020-06-20 19:38:54.194626,0 days 00:23:32.847429000,2.1470418638303557e-05,0.95,0.0002795993237135417,constant,512,0.20163298125561913,COMPLETE
26,0.791307806968689,2020-06-20 19:15:21.348879,2020-06-20 19:39:47.431322,0 days 00:24:26.082443000,1.3756815678516352e-08,0.9,0.0004061760166103599,linear,16,0.5019488083635973,COMPLETE
27,0.3809746205806732,2020-06-20 19:15:21.350568,2020-06-20 19:38:51.734671,0 days 00:23:30.384103000,1.559330185691739e-06,0.98,0.002231802874027929,constant,1024,0.22464883657442036,COMPLETE
28,0.5928901433944702,2020-06-20 19:15:21.352832,2020-06-20 19:39:36.031250,0 days 00:24:14.678418000,0.003956083571638925,0.99,0.07606378997419036,linear,32,0.5615353052188262,COMPLETE
29,0.30784139037132263,2020-06-20 19:15:21.354653,2020-06-20 19:39:24.336236,0 days 00:24:02.981583000,0.06698646124798065,0.98,0.9929715098063978,constant,128,0.3124728978898229,COMPLETE
30,1.2007884979248047,2020-06-20 19:15:21.356526,2020-06-20 19:38:39.166426,0 days 00:23:17.809900000,0.016031597184026324,0.98,0.05329950289939759,linear,512,0.8336237960010424,COMPLETE
31,0.48537683486938477,2020-06-20 19:15:21.358777,2020-06-20 19:38:50.550830,0 days 00:23:29.192053000,2.4755346347784875e-07,0.9999,0.09718824091969365,constant,512,0.7041646373595313,COMPLETE
32,0.4194716811180115,2020-06-20 19:38:34.360586,2020-06-20 20:02:44.464143,0 days 00:24:10.103557000,1.070183812323478e-08,0.9,0.0010004453580821626,linear,128,0.8875791272070878,COMPLETE
33,0.40593892335891724,2020-06-20 19:38:34.387090,2020-06-20 20:02:53.030036,0 days 00:24:18.642946000,1.8259787357139556e-06,0.9999,0.0003049716556095703,linear,32,0.02263864619015421,COMPLETE
34,0.39129409193992615,2020-06-20 19:38:39.175148,2020-06-20 20:02:35.708448,0 days 00:23:56.533300000,0.08683873363341012,0.9999,0.003044905945384985,constant,256,0.4420044492813824,COMPLETE
35,0.9573881030082703,2020-06-20 19:38:40.561696,2020-06-20 19:48:47.874634,0 days 00:10:07.312938000,0.017575850966139905,0.999,0.18136536709505344,linear,16,0.9207763024529521,PRUNED
36,0.4005401134490967,2020-06-20 19:38:46.705602,2020-06-20 20:03:27.164946,0 days 00:24:40.459344000,1.3301907930003199e-05,0.95,0.00046552817568515175,constant,32,0.4001382252143617,COMPLETE
37,1.118091106414795,2020-06-20 19:38:46.903586,2020-06-20 20:03:06.720551,0 days 00:24:19.816965000,0.003283363548029364,0.999,0.0004416951117286727,constant,128,0.29679555276058533,COMPLETE
38,1.4617946147918701,2020-06-20 19:38:49.549115,2020-06-20 19:48:55.428579,0 days 00:10:05.879464000,5.085417505434155e-06,0.9999,0.00024576877810153123,linear,16,0.06140477878947892,PRUNED
39,0.3977017402648926,2020-06-20 19:38:50.469128,2020-06-20 19:48:33.226870,0 days 00:09:42.757742000,9.582919383972747e-05,0.9999,0.003804243504605418,linear,1024,0.2050046002961634,PRUNED
40,0.4350016713142395,2020-06-20 19:38:50.551703,2020-06-20 19:48:40.940609,0 days 00:09:50.388906000,0.00014161610914559342,0.98,0.09930365310271308,linear,256,0.6271870078650181,PRUNED
41,0.34329158067703247,2020-06-20 19:38:51.472370,2020-06-20 20:02:33.323612,0 days 00:23:41.851242000,1.5566064525285126e-05,0.9,0.0060679306297755685,linear,1024,0.5360260805916705,COMPLETE
42,0.34773439168930054,2020-06-20 19:38:51.474959,2020-06-20 20:02:36.541918,0 days 00:23:45.066959000,2.8119959831234553e-06,0.95,0.004453106752182249,linear,1024,0.5508314326196636,COMPLETE
43,0.7920840978622437,2020-06-20 19:38:51.735613,2020-06-20 20:03:03.658236,0 days 00:24:11.922623000,3.1439207773174417e-06,0.9,0.012340644093548086,linear,64,0.6079443089922578,COMPLETE
44,0.5150124430656433,2020-06-20 19:38:51.782530,2020-06-20 19:48:43.069284,0 days 00:09:51.286754000,1.8486695716251273e-06,0.99,0.01591428209560337,linear,128,0.6146385488313444,PRUNED
45,0.6640032529830933,2020-06-20 19:38:51.943974,2020-06-20 19:48:51.876486,0 days 00:09:59.932512000,1.4003950744411903e-06,0.9,0.01302534035171612,linear,32,0.6224585949777248,PRUNED
46,0.7150614857673645,2020-06-20 19:38:54.195951,2020-06-20 20:03:22.476753,0 days 00:24:28.280802000,1.5088513791673879e-06,0.9,0.00013251271361571003,constant,64,0.022712161670516567,COMPLETE
47,0.5642648935317993,2020-06-20 19:38:56.787165,2020-06-20 19:49:11.470644,0 days 00:10:14.683479000,4.041631177588125e-06,0.95,0.00017698766419883816,constant,16,0.019753036933154444,PRUNED
48,0.3347589373588562,2020-06-20 19:38:58.215038,2020-06-20 20:03:10.091394,0 days 00:24:11.876356000,4.784773228624809e-06,0.95,0.00010592386178214103,constant,128,0.028023418793011262,COMPLETE
49,0.4203422963619232,2020-06-20 19:39:04.414905,2020-06-20 19:48:59.059248,0 days 00:09:54.644343000,2.74620992912435e-06,0.9,0.00018346529136666095,constant,128,0.03426946261232347,PRUNED
50,0.4350319504737854,2020-06-20 19:39:07.744373,2020-06-20 19:49:05.347736,0 days 00:09:57.603363000,5.905588131308086e-06,0.95,0.00018297581511231018,constant,128,0.04774799431812787,PRUNED
51,0.44508638978004456,2020-06-20 19:39:13.823439,2020-06-20 19:49:17.213753,0 days 00:10:03.390314000,4.739299027056815e-06,0.95,0.00017741167379354693,constant,128,0.045382107988819864,PRUNED
52,0.3405765891075134,2020-06-20 19:39:17.572826,2020-06-20 20:03:55.236431,0 days 00:24:37.663605000,5.518431110265185e-06,0.9,0.00021344715751502624,constant,32,0.04239461274990314,COMPLETE
53,0.4396131634712219,2020-06-20 19:39:19.046196,2020-06-20 20:03:37.348866,0 days 00:24:18.302670000,4.601563002941175e-06,0.9,0.00018293254740666428,constant,128,0.0545775630381653,COMPLETE
54,0.4101014733314514,2020-06-20 19:39:21.346893,2020-06-20 20:04:01.547512,0 days 00:24:40.200619000,4.65781659130787e-06,0.9,0.00013663975337888605,constant,32,0.012761132886225268,COMPLETE
55,0.6920496821403503,2020-06-20 19:39:21.442414,2020-06-20 19:49:28.434492,0 days 00:10:06.992078000,3.5482186992315673e-06,0.9,0.0001657782497840352,constant,32,0.023484319031492548,PRUNED
56,0.3991308808326721,2020-06-20 19:39:23.634852,2020-06-20 20:03:56.072774,0 days 00:24:32.437922000,1.0057884635073178e-05,0.9,0.00010336098071946182,constant,64,0.6409987282339246,COMPLETE
57,0.588995099067688,2020-06-20 19:39:24.340809,2020-06-20 20:04:31.688521,0 days 00:25:07.347712000,1.4748239776230436e-05,0.9,0.00014814962463593288,constant,32,0.6325464869486974,COMPLETE
58,0.5385626554489136,2020-06-20 19:39:26.747321,2020-06-20 20:04:34.943333,0 days 00:25:08.196012000,1.1444136264888927e-06,0.9,0.00012616143967158187,constant,16,0.6683501207192388,COMPLETE
59,0.38342946767807007,2020-06-20 19:39:29.945245,2020-06-20 20:04:09.306182,0 days 00:24:39.360937000,5.219804099345823e-06,0.9,0.00012989108315699532,constant,64,0.6774966684730364,COMPLETE
60,0.7925962209701538,2020-06-20 19:39:31.187225,2020-06-20 20:04:51.496941,0 days 00:25:20.309716000,9.312133796331077e-06,0.9,0.00011307493591898162,constant,16,0.6644954744743603,COMPLETE
61,0.4291211664676666,2020-06-20 19:39:34.462379,2020-06-20 20:04:04.544259,0 days 00:24:30.081880000,7.0620006069779345e-06,0.9,0.00013255217197931512,constant,64,0.9739171228611971,COMPLETE
62,0.37008386850357056,2020-06-20 19:39:36.032658,2020-06-20 20:03:47.613012,0 days 00:24:11.580354000,4.520520724331287e-06,0.9,0.00010363029930224198,constant,128,0.0346348771764583,COMPLETE
63,0.3684319257736206,2020-06-20 19:39:47.432486,2020-06-20 20:04:17.707540,0 days 00:24:30.275054000,5.617821184873631e-06,0.9,0.00011769446922503513,constant,128,0.0402572101577878,COMPLETE
64,0.40701788663864136,2020-06-20 19:48:36.139556,2020-06-20 19:58:49.907876,0 days 00:10:13.768320000,6.810387680070207e-06,0.9,0.00012595324876983846,constant,128,0.020385302895369384,PRUNED
65,0.5418204665184021,2020-06-20 19:48:43.039072,2020-06-20 19:58:57.280017,0 days 00:10:14.240945000,7.92711072141131e-06,0.9,0.00015689621770298304,constant,128,0.0603632219873973,PRUNED
66,0.37453126907348633,2020-06-20 19:48:45.363742,2020-06-20 20:12:35.876930,0 days 00:23:50.513188000,4.45229004277314e-06,0.9,0.00011643525801249977,constant,128,0.026977013210886615,COMPLETE
67,0.38480430841445923,2020-06-20 19:48:49.942348,2020-06-20 20:12:43.323844,0 days 00:23:53.381496000,7.4628595378811635e-06,0.9,0.00012364044744326658,constant,128,0.05196400535054707,COMPLETE
68,0.3955598771572113,2020-06-20 19:48:54.093531,2020-06-20 19:59:08.201308,0 days 00:10:14.107777000,6.115156389734161e-06,0.9,0.00011805969891415661,constant,128,0.0018904769814998834,PRUNED
69,0.3750010132789612,2020-06-20 19:48:57.840462,2020-06-20 20:12:36.190286,0 days 00:23:38.349824000,1.0871178364686763e-05,0.9,0.00010743041031930912,constant,128,0.004519137923149508,COMPLETE
70,0.48878803849220276,2020-06-20 19:49:01.498176,2020-06-20 19:59:06.158370,0 days 00:10:04.660194000,9.064746665174078e-06,0.95,0.00010630272737970544,constant,64,0.44262002419232377,PRUNED
71,0.4899691045284271,2020-06-20 19:49:07.299688,2020-06-20 20:12:42.715257,0 days 00:23:35.415569000,4.2189345456712375e-05,0.995,9.35383136303391e-05,constant,64,0.432028840150471,COMPLETE
72,0.4552811086177826,2020-06-20 19:49:13.824674,2020-06-20 20:12:57.847789,0 days 00:23:44.023115000,1.0052690683397512e-05,0.995,1.0347385990392499e-05,constant,64,0.42393773019902614,COMPLETE
73,0.35593941807746887,2020-06-20 19:49:18.869684,2020-06-20 20:12:56.015431,0 days 00:23:37.145747000,5.611986405147346e-07,0.995,9.258560075478721e-05,constant,64,0.4375553521399788,COMPLETE
74,0.4342154562473297,2020-06-20 19:49:30.306236,2020-06-20 19:59:32.334318,0 days 00:10:02.028082000,3.7366418073259207e-05,0.98,8.739166986605026e-05,constant,64,0.41472815603624535,PRUNED
75,0.47312527894973755,2020-06-20 19:58:52.518929,2020-06-20 20:09:21.227028,0 days 00:10:28.708099000,3.61032574347501e-05,0.995,8.296078752222746e-05,constant,64,0.4185436356910009,PRUNED
76,0.45354795455932617,2020-06-20 19:58:59.503922,2020-06-20 20:09:29.336127,0 days 00:10:29.832205000,2.7555275354979143e-05,0.995,7.851545852425656e-05,constant,64,0.4341466004878088,PRUNED
77,2.7051849365234375,2020-06-20 19:59:08.201660,2020-06-20 20:09:34.402842,0 days 00:10:26.201182000,5.087513784574999e-07,0.995,0.9817487617813521,constant,64,0.3785214115433123,PRUNED
78,1.0833228826522827,2020-06-20 19:59:08.405624,2020-06-20 20:09:40.260003,0 days 00:10:31.854379000,4.998503588635829e-07,0.995,0.006240406481088255,constant,64,0.3784851772570379,PRUNED
79,1.056962251663208,2020-06-20 19:59:37.786285,2020-06-20 20:09:57.775216,0 days 00:10:19.988931000,4.2435306823577625e-07,0.995,0.8327763401465721,constant,32,0.35831829736002657,PRUNED
80,0.3997983932495117,2020-06-20 20:02:35.698528,2020-06-20 20:12:21.778948,0 days 00:09:46.080420000,6.194248049822654e-07,0.995,2.3131758911980828e-05,constant,32,0.3595325525533577,PRUNED
81,0.4910908341407776,2020-06-20 20:02:35.722881,2020-06-20 20:12:18.516709,0 days 00:09:42.793828000,4.782706165571513e-07,0.995,2.485375635546019e-05,constant,32,0.28472059330640503,PRUNED
82,1.757091760635376,2020-06-20 20:02:36.543328,2020-06-20 20:12:11.987312,0 days 00:09:35.443984000,2.5795703670892225e-05,0.995,0.00034913448221946745,constant,32,0.13815855553936557,PRUNED
83,0.7071781158447266,2020-06-20 20:02:44.466191,2020-06-20 20:12:29.861174,0 days 00:09:45.394983000,4.982817797976962e-07,0.995,0.00041235214563250004,constant,32,0.15198942107046512,PRUNED
84,0.5948160886764526,2020-06-20 20:02:53.032109,2020-06-20 20:12:27.472765,0 days 00:09:34.440656000,2.089122133417218e-05,0.995,0.0005845522733296895,constant,64,0.15004403453985002,PRUNED
85,0.38697192072868347,2020-06-20 20:03:03.659801,2020-06-20 20:15:50.743885,0 days 00:12:47.084084000,5.186736538083574e-07,0.995,0.0006364435993219111,constant,2048,0.15367124399279175,COMPLETE
86,0.36809295415878296,2020-06-20 20:03:06.724256,2020-06-20 20:15:53.613432,0 days 00:12:46.889176000,6.484768460408622e-07,0.995,0.8091669578077294,constant,2048,0.1297485164754151,COMPLETE
87,0.5314929485321045,2020-06-20 20:03:10.117480,2020-06-20 20:15:53.457733,0 days 00:12:43.340253000,4.613032972114608e-07,0.995,0.9365314827912443,constant,2048,0.12574599587373164,COMPLETE
88,0.3903036117553711,2020-06-20 20:03:22.479068,2020-06-20 20:15:56.598975,0 days 00:12:34.119907000,5.658709807157704e-07,0.995,1.1589501605524229e-05,constant,2048,0.12969860063154592,COMPLETE
89,0.5526328086853027,2020-06-20 20:03:27.167620,2020-06-20 20:15:55.006366,0 days 00:12:27.838746000,4.671816120114084e-07,0.995,0.8685059769268226,constant,2048,0.136608003787795,COMPLETE
90,0.39457812905311584,2020-06-20 20:03:37.359283,2020-06-20 20:12:48.995528,0 days 00:09:11.636245000,3.463784270228012e-07,0.995,3.0499047024283126e-05,constant,2048,0.1279792679515566,PRUNED
91,0.42091673612594604,2020-06-20 20:03:47.616521,2020-06-20 20:12:45.889645,0 days 00:08:58.273124000,4.917765219098958e-07,0.995,2.2983211844667442e-05,constant,2048,0.13122423250032178,PRUNED
92,0.3721463084220886,2020-06-20 20:03:55.237645,2020-06-20 20:15:54.450331,0 days 00:11:59.212686000,2.020384199246268e-07,0.995,2.7707159583657562e-05,linear,2048,0.1271570793191354,COMPLETE
93,0.3769453167915344,2020-06-20 20:03:56.076616,2020-06-20 20:15:56.432893,0 days 00:12:00.356277000,6.164721072199439e-07,0.995,2.5403616584222814e-05,linear,2048,0.25283063289245183,COMPLETE
94,0.37869781255722046,2020-06-20 20:04:01.549067,2020-06-20 20:15:58.148190,0 days 00:11:56.599123000,4.975766081950634e-07,0.995,2.4224875075178505e-05,linear,2048,0.16692482887587232,COMPLETE
95,0.4930741786956787,2020-06-20 20:04:04.545771,2020-06-20 20:12:57.768592,0 days 00:08:53.222821000,2.53221695035409e-05,0.995,2.5141950488285333e-05,linear,2048,0.3513558841446522,PRUNED
96,0.4253782331943512,2020-06-20 20:04:09.313295,2020-06-20 20:12:57.696547,0 days 00:08:48.383252000,6.615311951421406e-07,0.995,3.215286808155487e-05,linear,2048,0.14916867512810353,PRUNED
97,0.4168106019496918,2020-06-20 20:04:17.708915,2020-06-20 20:13:02.452188,0 days 00:08:44.743273000,1.591914458055864e-07,0.995,2.659196890738849e-05,linear,2048,0.1164668165749124,PRUNED
98,0.38473808765411377,2020-06-20 20:04:31.693514,2020-06-20 20:16:00.820096,0 days 00:11:29.126582000,8.352989865921837e-07,0.995,2.3675673327936226e-05,linear,2048,0.1452939118857111,COMPLETE
99,0.42512422800064087,2020-06-20 20:04:34.963407,2020-06-20 20:16:00.883754,0 days 00:11:25.920347000,4.6920630628626276e-05,0.995,1.0103633279822189e-05,linear,2048,0.14261142234599658,COMPLETE
