number,value,datetime_start,datetime_complete,duration,params_batch_size,params_buffer_size,params_gamma,params_lr,params_noise_std,params_noise_type,params_train_freq,state
0,4.296818256378174,2020-06-26 17:42:58.713595,2020-06-26 18:00:01.858828,0 days 00:17:03.145233000,64,100000,0.99,0.011013563511090781,0.05931474082519417,ornstein-uhlenbeck,2000,COMPLETE
1,2.580920696258545,2020-06-26 18:00:01.859898,2020-06-26 18:16:43.469098,0 days 00:16:41.609200000,16,100000,0.995,1.3872063987145433e-05,0.41285991954771883,ornstein-uhlenbeck,10,COMPLETE
2,4.543313503265381,2020-06-26 18:16:43.470395,2020-06-26 18:39:39.503601,0 days 00:22:56.033206000,32,10000,0.99,0.030367176108293564,0.41849977919326364,ornstein-uhlenbeck,1,COMPLETE
3,1.5598169565200806,2020-06-26 18:39:39.505385,2020-06-26 19:36:45.621601,0 days 00:57:06.116216000,256,1000000,0.999,0.0009456723245330915,0.11647590171187838,normal,1,COMPLETE
4,2.5550389289855957,2020-06-26 19:36:45.622913,2020-06-26 21:14:39.357953,0 days 01:37:53.735040000,512,100000,0.999,0.37686207233895386,0.27153027185198564,ornstein-uhlenbeck,1000,COMPLETE
5,2.0480189323425293,2020-06-26 21:14:39.359608,2020-06-26 21:37:06.577808,0 days 00:22:27.218200000,16,100000,0.98,0.0005565382283093996,0.6760222932849669,ornstein-uhlenbeck,2000,COMPLETE
6,2.5550389289855957,2020-06-26 21:37:06.578913,2020-06-26 22:32:09.883320,0 days 00:55:03.304407000,256,10000,0.9999,0.005465121800524359,0.7254033006578954,normal,100,COMPLETE
7,1.4776637554168701,2020-06-26 22:32:09.884738,2020-06-26 23:30:00.538302,0 days 00:57:50.653564000,256,10000,0.995,0.0002714982264936502,0.897884923046852,normal,2000,COMPLETE
8,3.405569076538086,2020-06-26 23:30:00.539969,2020-06-26 23:59:30.483396,0 days 00:29:29.943427000,64,10000,0.9,0.0006827419874326356,0.3288191918114657,ornstein-uhlenbeck,1000,COMPLETE
9,3.089526414871216,2020-06-26 23:59:30.484805,2020-06-27 00:30:42.718408,0 days 00:31:12.233603000,64,1000000,0.995,0.03474634589323286,0.7824848265767536,ornstein-uhlenbeck,2000,COMPLETE
10,2.6821436882019043,2020-06-27 00:30:42.720127,2020-06-27 00:41:11.227842,0 days 00:10:28.507715000,128,10000,0.95,4.352249497962428e-05,0.9953326113709854,normal,10,PRUNED
11,1.5759693384170532,2020-06-27 00:41:11.373190,2020-06-27 01:36:58.483227,0 days 00:55:47.110037000,256,1000000,0.999,0.00018469181055385771,0.01597092857090887,normal,1,COMPLETE
12,1.3066303730010986,2020-06-27 01:36:58.484662,2020-06-27 02:11:23.249670,0 days 00:34:24.765008000,100,1000000,0.999,0.00012617175664511859,0.9212220300282399,normal,1,COMPLETE
13,1.4173223972320557,2020-06-27 02:11:23.251647,2020-06-27 02:45:42.794498,0 days 00:34:19.542851000,100,1000000,0.995,8.12534185582057e-05,0.9870866213818865,normal,2000,COMPLETE
14,3.634516954421997,2020-06-27 02:45:42.796327,2020-06-27 03:00:42.029802,0 days 00:14:59.233475000,100,1000000,0.995,1.3740010103409387e-05,0.9830379482796461,normal,100,PRUNED
15,1.588623046875,2020-06-27 03:00:42.269933,2020-06-27 03:33:40.912448,0 days 00:32:58.642515000,100,1000000,0.999,6.0301584935740304e-05,0.6233546310651685,normal,1,COMPLETE
16,1.3404760360717773,2020-06-27 03:33:40.913635,2020-06-27 04:05:10.607487,0 days 00:31:29.693852000,100,1000000,0.98,8.923307051775792e-05,0.8592046638958089,normal,2000,COMPLETE
17,1.4016774892807007,2020-06-27 04:05:10.608995,2020-06-27 04:41:04.363701,0 days 00:35:53.754706000,100,1000000,0.98,0.0019152806607177703,0.8481474154163096,normal,1,COMPLETE
18,2.7879443168640137,2020-06-27 04:41:04.365253,2020-06-27 05:14:36.681084,0 days 00:33:32.315831000,100,1000000,0.98,1.8531796114868245e-05,0.5730400252605455,normal,2000,COMPLETE
19,1.3964271545410156,2020-06-27 05:14:36.683018,2020-06-27 05:55:01.131756,0 days 00:40:24.448738000,128,1000000,0.95,0.00016755052433334083,0.8879611907716884,normal,10,COMPLETE
20,1.4528305530548096,2020-06-27 05:55:01.133324,2020-06-27 06:20:33.598197,0 days 00:25:32.464873000,32,1000000,0.9,2.5496793786851162e-05,0.7777275196160448,normal,1,COMPLETE
21,1.3175400495529175,2020-06-27 06:20:33.600233,2020-06-27 07:00:10.850127,0 days 00:39:37.249894000,128,1000000,0.95,0.00018675145907761552,0.9111975514689886,normal,10,COMPLETE
22,1.273524522781372,2020-06-27 07:00:10.851899,2020-06-27 07:35:56.366716,0 days 00:35:45.514817000,128,1000000,0.95,0.00012096317508258214,0.8992950118246341,normal,10,COMPLETE
23,1.4103091955184937,2020-06-27 07:35:56.367949,2020-06-27 08:13:24.955204,0 days 00:37:28.587255000,128,1000000,0.95,0.00032634255520517906,0.9501664217222764,normal,10,COMPLETE
24,1.352741003036499,2020-06-27 08:13:24.956825,2020-06-27 08:53:11.149224,0 days 00:39:46.192399000,128,1000000,0.95,0.001329456541527184,0.7893778381936863,normal,10,COMPLETE
25,4.337153434753418,2020-06-27 08:53:11.150994,2020-06-27 09:06:32.019417,0 days 00:13:20.868423000,128,1000000,0.95,0.00370296189915597,0.5423730526943709,normal,10,PRUNED
26,1.8357681035995483,2020-06-27 09:06:32.245582,2020-06-27 10:38:38.484158,0 days 01:32:06.238576000,512,1000000,0.9999,0.000147893067138695,0.7001332372139557,normal,10,COMPLETE
27,1.2942501306533813,2020-06-27 10:38:38.485405,2020-06-27 11:13:32.454057,0 days 00:34:53.968652000,128,1000000,0.95,4.943817430211282e-05,0.9295666391035736,normal,10,COMPLETE
28,1.8160688877105713,2020-06-27 11:13:32.456459,2020-06-27 11:51:32.048869,0 days 00:37:59.592410000,128,1000000,0.95,4.092724298499004e-05,0.789964838482579,normal,10,COMPLETE
29,1.4184578657150269,2020-06-27 11:51:32.051158,2020-06-27 12:30:39.458002,0 days 00:39:07.406844000,128,100000,0.99,1.1809901077406995e-05,0.9953853495916208,normal,1000,COMPLETE
30,1.3986151218414307,2020-06-27 12:30:39.459889,2020-06-27 12:53:57.392077,0 days 00:23:17.932188000,16,1000000,0.999,0.0003930660730744465,0.8356762505176328,normal,100,COMPLETE
31,2.275378942489624,2020-06-27 12:53:57.393704,2020-06-27 13:32:09.815658,0 days 00:38:12.421954000,128,1000000,0.95,9.934965449322315e-05,0.9340753329684431,normal,10,COMPLETE
32,1.4512284994125366,2020-06-27 13:32:09.817377,2020-06-27 14:10:03.309809,0 days 00:37:53.492432000,128,1000000,0.95,3.421122584540299e-05,0.9198827633503838,normal,10,COMPLETE
33,1.3438177108764648,2020-06-27 14:10:03.311537,2020-06-27 14:48:46.044846,0 days 00:38:42.733309000,128,1000000,0.95,0.00023609950231291287,0.9375092824132855,normal,10,COMPLETE
34,1.6050077676773071,2020-06-27 14:48:46.046535,2020-06-27 15:13:54.897189,0 days 00:25:08.850654000,32,1000000,0.95,9.695933488102144e-05,0.8441382535880235,normal,10,COMPLETE
35,4.337153434753418,2020-06-27 15:13:54.898892,2020-06-27 15:27:22.755273,0 days 00:13:27.856381000,128,100000,0.99,0.008515021343822511,0.7293600119579571,normal,1,PRUNED
36,2.392169713973999,2020-06-27 15:27:22.989316,2020-06-27 17:00:08.122771,0 days 01:32:45.133455000,512,1000000,0.999,0.000873039692623548,0.19126091548090052,ornstein-uhlenbeck,10,COMPLETE
37,1.4979134798049927,2020-06-27 17:00:08.124744,2020-06-27 17:24:18.270813,0 days 00:24:10.146069000,16,1000000,0.95,0.0019960688015921452,0.9958925189424169,normal,10,COMPLETE
38,5.614269256591797,2020-06-27 17:24:18.272484,2020-06-27 17:58:46.082047,0 days 00:34:27.809563000,128,100000,0.9999,0.01924173313274526,0.6580353591932493,normal,1,COMPLETE
39,2.7864937782287598,2020-06-27 17:58:46.083373,2020-06-27 18:22:40.386908,0 days 00:23:54.303535000,64,10000,0.9,1.0241151162627731e-05,0.4470318655940854,ornstein-uhlenbeck,1000,COMPLETE
40,1.6814651489257812,2020-06-27 18:22:40.388389,2020-06-27 18:45:18.921083,0 days 00:22:38.532694000,32,1000000,0.999,0.0004158472925919266,0.8909990210070861,normal,10,COMPLETE
41,1.455338716506958,2020-06-27 18:45:18.922763,2020-06-27 19:13:49.740572,0 days 00:28:30.817809000,100,1000000,0.98,5.627445747281407e-05,0.8555096549505975,normal,2000,COMPLETE
42,4.2209062576293945,2020-06-27 19:13:49.742234,2020-06-27 19:42:21.005297,0 days 00:28:31.263063000,100,1000000,0.98,2.4178107592081082e-05,0.7436807941014326,normal,2000,COMPLETE
43,1.3963366746902466,2020-06-27 19:42:21.006858,2020-06-27 20:08:15.356001,0 days 00:25:54.349143000,100,1000000,0.98,0.00011309765891883497,0.8696037432570886,normal,2000,COMPLETE
44,1.2759723663330078,2020-06-27 20:08:15.357615,2020-06-27 20:34:58.642907,0 days 00:26:43.285292000,100,1000000,0.95,5.708455733229696e-05,0.8192317768545069,normal,100,COMPLETE
45,1.5041720867156982,2020-06-27 20:34:58.644324,2020-06-27 21:18:43.718174,0 days 00:43:45.073850000,256,1000000,0.95,4.399081392340408e-05,0.9554179262318041,normal,100,COMPLETE
46,4.831225872039795,2020-06-27 21:18:43.719799,2020-06-27 21:28:41.158623,0 days 00:09:57.438824000,128,10000,0.95,0.33352158200949295,0.8189780317746305,normal,100,PRUNED
47,2.0447611808776855,2020-06-27 21:28:41.308831,2020-06-27 21:50:00.892632,0 days 00:21:19.583801000,64,1000000,0.95,0.0006894454063509641,0.9319681369128581,ornstein-uhlenbeck,100,COMPLETE
48,1.404837965965271,2020-06-27 21:50:00.894324,2020-06-27 22:16:55.200247,0 days 00:26:54.305923000,100,1000000,0.95,0.00021836090289681194,0.9031977283096011,normal,100,COMPLETE
49,1.4007229804992676,2020-06-27 22:16:55.201996,2020-06-27 23:33:22.235815,0 days 01:16:27.033819000,512,100000,0.999,6.0307884648127536e-05,0.999672139872771,normal,1,COMPLETE
50,1.3430988788604736,2020-06-27 23:33:22.237563,2020-06-27 23:45:36.385385,0 days 00:12:14.147822000,100,1000000,0.95,1.903084756731706e-05,0.35036087008669875,normal,100,PRUNED
51,1.5405569076538086,2020-06-27 23:45:36.561596,2020-06-28 00:11:45.019819,0 days 00:26:08.458223000,100,1000000,0.98,9.536051196713082e-05,0.7658462167461073,normal,2000,COMPLETE
52,1.8229835033416748,2020-06-28 00:11:45.021579,2020-06-28 00:37:42.578338,0 days 00:25:57.556759000,100,1000000,0.99,0.00017306006848701494,0.8133360302025604,normal,10,COMPLETE
53,1.6256452798843384,2020-06-28 00:37:42.579814,2020-06-28 01:04:05.353871,0 days 00:26:22.774057000,100,1000000,0.995,7.655061578091274e-05,0.9604128940059757,normal,1,COMPLETE
54,1.5373013019561768,2020-06-28 01:04:05.355397,2020-06-28 01:31:37.083463,0 days 00:27:31.728066000,100,1000000,0.95,3.529755729872153e-05,0.8631064643351201,normal,1000,COMPLETE
55,1.5179200172424316,2020-06-28 01:31:37.084992,2020-06-28 02:03:10.497135,0 days 00:31:33.412143000,128,1000000,0.999,0.0005023658529181586,0.8853954844442798,normal,2000,COMPLETE
56,1.3053505420684814,2020-06-28 02:03:10.498713,2020-06-28 02:50:05.028542,0 days 00:46:54.529829000,256,1000000,0.9,0.00014017275190276521,0.692515069782335,normal,10,COMPLETE
57,1.5868446826934814,2020-06-28 02:50:05.030145,2020-06-28 03:36:54.207469,0 days 00:46:49.177324000,256,10000,0.9,0.00014539536397692357,0.6047306418794284,normal,10,COMPLETE
58,1.6682708263397217,2020-06-28 03:36:54.208956,2020-06-28 04:23:14.051323,0 days 00:46:19.842367000,256,1000000,0.9,0.0002798272715751917,0.6575228568382608,normal,10,COMPLETE
59,1.9013442993164062,2020-06-28 04:23:14.053083,2020-06-28 04:44:15.883511,0 days 00:21:01.830428000,256,1000000,0.9,2.577608535997669e-05,0.7552953627866261,normal,10,PRUNED
60,1.5793488025665283,2020-06-28 04:44:16.075881,2020-06-28 05:30:33.603903,0 days 00:46:17.528022000,256,1000000,0.9999,5.474679379207367e-05,0.8086097698746167,ornstein-uhlenbeck,10,COMPLETE
61,1.4233994483947754,2020-06-28 05:30:33.605447,2020-06-28 05:57:09.516343,0 days 00:26:35.910896000,100,1000000,0.9,0.00012454644019163028,0.9073791383633186,normal,10,COMPLETE
62,1.3161232471466064,2020-06-28 05:57:09.517950,2020-06-28 06:16:18.152826,0 days 00:19:08.634876000,16,1000000,0.95,7.161311718840946e-05,0.7107366462905563,normal,1,COMPLETE
63,1.3820302486419678,2020-06-28 06:16:18.154642,2020-06-28 06:35:58.697598,0 days 00:19:40.542956000,16,1000000,0.95,1.4874757920365288e-05,0.7107281897922915,normal,1,COMPLETE
64,1.7700932025909424,2020-06-28 06:35:58.699352,2020-06-28 06:55:27.278308,0 days 00:19:28.578956000,16,1000000,0.95,0.00029563176271376295,0.5075341691108146,normal,1,COMPLETE
65,2.4544687271118164,2020-06-28 06:55:27.280045,2020-06-28 07:04:12.461329,0 days 00:08:45.181284000,16,1000000,0.95,7.209721652367124e-05,0.7098680716009345,normal,1,PRUNED
66,1.6546943187713623,2020-06-28 07:04:12.675439,2020-06-28 07:35:37.365641,0 days 00:31:24.690202000,128,1000000,0.95,3.1106001311226914e-05,0.6220374322515932,normal,1,COMPLETE
67,1.2677643299102783,2020-06-28 07:35:37.367348,2020-06-28 07:44:02.538029,0 days 00:08:25.170681000,16,1000000,0.95,0.00020614789394765215,0.7944756954065644,normal,10,PRUNED
68,1.4453271627426147,2020-06-28 07:44:02.731960,2020-06-28 08:16:02.700664,0 days 00:31:59.968704000,128,1000000,0.95,0.0001333523766269882,0.9697514000276148,normal,1,COMPLETE
69,1.338257074356079,2020-06-28 08:16:02.702524,2020-06-28 08:48:08.206168,0 days 00:32:05.503644000,128,1000000,0.995,5.3503389001906986e-05,0.6873347046943735,normal,10,COMPLETE
70,1.3106945753097534,2020-06-28 08:48:08.208068,2020-06-28 09:08:32.231541,0 days 00:20:24.023473000,32,1000000,0.999,0.0012376273126398277,0.8191211601326281,normal,100,COMPLETE
71,1.2302418947219849,2020-06-28 09:08:32.233307,2020-06-28 09:27:51.798845,0 days 00:19:19.565538000,32,1000000,0.999,0.0011249286976613144,0.8326412050184251,normal,100,COMPLETE
72,1.4093332290649414,2020-06-28 09:27:51.800677,2020-06-28 09:47:15.787176,0 days 00:19:23.986499000,32,1000000,0.999,0.001193496796894984,0.8262917513108786,normal,100,COMPLETE
73,3.9687671661376953,2020-06-28 09:47:15.789186,2020-06-28 09:52:38.563041,0 days 00:05:22.773855000,32,1000000,0.999,0.006360131125070903,0.7664437901330459,normal,100,PRUNED
74,1.4172807931900024,2020-06-28 09:52:38.742859,2020-06-28 10:11:56.685371,0 days 00:19:17.942512000,32,1000000,0.999,0.0016004232211848924,0.8494006625219269,normal,100,COMPLETE
75,1.3737595081329346,2020-06-28 10:11:56.687214,2020-06-28 10:31:54.965058,0 days 00:19:58.277844000,32,1000000,0.999,0.0010152163893387234,0.8806081395914703,normal,100,COMPLETE
76,4.745392799377441,2020-06-28 10:31:54.966774,2020-06-28 10:40:54.871982,0 days 00:08:59.905208000,32,1000000,0.999,0.003037399812170027,0.7828241892011133,normal,100,PRUNED
77,1.4979135990142822,2020-06-28 10:40:55.063754,2020-06-28 11:01:06.135110,0 days 00:20:11.071356000,32,1000000,0.999,0.0027638455852768483,0.7289790717409277,normal,100,COMPLETE
78,1.3008224964141846,2020-06-28 11:01:06.137049,2020-06-28 11:20:26.174906,0 days 00:19:20.037857000,32,100000,0.999,0.000660747346934778,0.9188080874620939,normal,100,COMPLETE
79,1.6630302667617798,2020-06-28 11:20:26.176604,2020-06-28 11:39:26.297650,0 days 00:19:00.121046000,32,100000,0.999,0.0005795829463706765,0.9311584838938106,normal,100,COMPLETE
80,1.4507137537002563,2020-06-28 11:39:26.299408,2020-06-28 11:59:19.178050,0 days 00:19:52.878642000,32,100000,0.999,0.000773180600851294,0.9777702229103461,normal,100,COMPLETE
81,1.1603970527648926,2020-06-28 11:59:19.179975,2020-06-28 12:08:18.364069,0 days 00:08:59.184094000,32,100000,0.999,0.0004310900549656586,0.8344920385472968,normal,100,PRUNED
82,1.914520263671875,2020-06-28 12:08:18.550704,2020-06-28 12:16:50.747853,0 days 00:08:32.197149000,32,100000,0.999,0.0020793964757779898,0.9127150397540329,normal,100,PRUNED
83,1.9099204540252686,2020-06-28 12:16:50.960050,2020-06-28 12:27:21.109410,0 days 00:10:30.149360000,64,100000,0.999,8.114913640920022e-05,0.8759426849406046,normal,100,PRUNED
84,1.447383999824524,2020-06-28 12:27:21.318765,2020-06-28 13:43:00.795087,0 days 01:15:39.476322000,512,10000,0.9,0.0003123608980082216,0.942427430353212,normal,100,COMPLETE
85,3.2341532707214355,2020-06-28 13:43:00.796676,2020-06-28 13:50:04.450135,0 days 00:07:03.653459000,16,1000000,0.99,0.004150335800412779,0.6677704634926204,normal,1,PRUNED
86,1.7046802043914795,2020-06-28 13:50:04.648320,2020-06-28 14:11:41.977833,0 days 00:21:37.329513000,256,1000000,0.999,0.0015554609463405726,0.8047588779477675,normal,1000,PRUNED
87,1.61434006690979,2020-06-28 14:11:42.171872,2020-06-28 14:32:36.305288,0 days 00:20:54.133416000,32,100000,0.9999,4.3759908478861894e-05,0.5678864493339015,ornstein-uhlenbeck,100,COMPLETE
88,2.899291515350342,2020-06-28 14:32:36.307136,2020-06-28 14:42:26.434540,0 days 00:09:50.127404000,32,1000000,0.999,0.0005780387098541953,0.8412984832001456,normal,1,PRUNED
89,1.3656971454620361,2020-06-28 14:42:26.660666,2020-06-28 15:30:05.267367,0 days 00:47:38.606701000,256,1000000,0.95,0.00010938918500691074,0.7362306899926786,normal,100,COMPLETE
90,4.07596492767334,2020-06-28 15:30:05.269390,2020-06-28 15:48:57.994572,0 days 00:18:52.725182000,16,1000000,0.9,0.0009973512664500123,0.91182430425858,normal,100,COMPLETE
91,1.4420077800750732,2020-06-28 15:48:57.996416,2020-06-28 16:19:46.813637,0 days 00:30:48.817221000,128,1000000,0.95,0.00018946538049809743,0.8927932930028099,normal,10,COMPLETE
92,1.4017932415008545,2020-06-28 16:19:46.815590,2020-06-28 16:50:20.351805,0 days 00:30:33.536215000,128,1000000,0.95,0.000360667641753215,0.9530072530698361,normal,10,COMPLETE
93,1.4086945056915283,2020-06-28 16:50:20.353625,2020-06-28 17:21:11.250520,0 days 00:30:50.896895000,128,1000000,0.95,0.00015723794745187006,0.8625744459752114,normal,10,COMPLETE
94,1.45024836063385,2020-06-28 17:21:11.252544,2020-06-28 17:52:23.390390,0 days 00:31:12.137846000,128,1000000,0.95,6.709885031051575e-05,0.9967315093556456,normal,10,COMPLETE
95,1.2539840936660767,2020-06-28 17:52:23.392550,2020-06-28 18:04:37.508185,0 days 00:12:14.115635000,100,1000000,0.95,0.00023988265429672045,0.9135811849181388,normal,10,PRUNED
96,2.5078628063201904,2020-06-28 18:04:37.698108,2020-06-28 18:35:09.632581,0 days 00:30:31.934473000,128,1000000,0.999,9.89284258599369e-05,0.9718890520230764,normal,10,COMPLETE
97,1.137420415878296,2020-06-28 18:35:09.634698,2020-06-28 18:45:13.498075,0 days 00:10:03.863377000,64,1000000,0.95,3.171756167704746e-05,0.8326828942890847,normal,1,PRUNED
98,1.6463254690170288,2020-06-28 18:45:13.689331,2020-06-28 19:11:55.218609,0 days 00:26:41.529278000,100,1000000,0.995,4.800298141235332e-05,0.8774780664217782,normal,10,COMPLETE
99,1.6142688989639282,2020-06-28 19:11:55.220545,2020-06-28 19:33:31.360728,0 days 00:21:36.140183000,32,10000,0.95,0.0001332936245103171,0.7624457170305654,normal,100,COMPLETE
