number,value,datetime_start,datetime_complete,duration,params_ent_coef,params_gamma,params_lr,params_lr_schedule,params_n_steps,params_vf_coef,state
0,0.8779336214065552,2020-06-22 23:57:52.638061,2020-06-22 23:58:33.458712,0 days 00:00:40.820651000,5.767989936188226e-06,0.95,0.6361100701718335,constant,32,0.21992631903626592,COMPLETE
1,1.7134301662445068,2020-06-22 23:58:33.459637,2020-06-22 23:59:11.921184,0 days 00:00:38.461547000,6.066022335858976e-07,0.95,0.10400334976608581,constant,128,0.5761143609680798,COMPLETE
2,1.454171061515808,2020-06-22 23:59:11.922122,2020-06-22 23:59:48.415527,0 days 00:00:36.493405000,0.0008431158732666831,0.9,0.004996892513461565,constant,128,0.830341145405121,COMPLETE
3,1.9781043529510498,2020-06-22 23:59:48.416480,2020-06-23 00:00:25.318695,0 days 00:00:36.902215000,5.412541800151543e-06,0.9,0.002175659507978225,constant,16,0.6368260365370676,COMPLETE
4,1.6381919384002686,2020-06-23 00:00:25.319636,2020-06-23 00:01:02.929453,0 days 00:00:37.609817000,0.018770531062227716,0.9,0.003340050355659866,linear,1024,0.20808872313576499,COMPLETE
5,2.075455904006958,2020-06-23 00:01:02.930431,2020-06-23 00:01:39.341734,0 days 00:00:36.411303000,2.0660933616435974e-08,0.9999,0.00026164356281689784,linear,128,0.7363945908175984,COMPLETE
6,1.5669816732406616,2020-06-23 00:01:39.342675,2020-06-23 00:02:13.682504,0 days 00:00:34.339829000,0.00647523961700381,0.999,0.07017782102201953,constant,1024,0.3828925082754644,COMPLETE
7,1.356285810470581,2020-06-23 00:02:13.683441,2020-06-23 00:02:50.682209,0 days 00:00:36.998768000,0.002265213859403541,0.99,0.005312390712906294,constant,64,0.30679663539091206,COMPLETE
8,1.685302734375,2020-06-23 00:02:50.683137,2020-06-23 00:03:28.429604,0 days 00:00:37.746467000,3.9823257357494826e-08,0.9,0.001762647845395378,constant,512,0.8606644158469621,COMPLETE
9,1.4068818092346191,2020-06-23 00:03:28.430611,2020-06-23 00:04:06.238971,0 days 00:00:37.808360000,4.8890627147554504e-08,0.95,0.13580386346825338,constant,2048,0.01963966037695619,COMPLETE
10,0.9441871643066406,2020-06-23 00:04:06.239924,2020-06-23 00:04:38.609051,0 days 00:00:32.369127000,7.495802809598791e-05,0.995,1.1504025793612865e-05,linear,32,0.007029415572626874,PRUNED
11,1.2708077430725098,2020-06-23 00:04:38.697958,2020-06-23 00:05:06.404599,0 days 00:00:27.706641000,7.776180511925088e-05,0.99,0.7529674503474014,constant,64,0.32234397956120786,PRUNED
12,0.9438009262084961,2020-06-23 00:05:06.494135,2020-06-23 00:05:40.335859,0 days 00:00:33.841724000,5.1226874548287935e-06,0.98,3.156542723946314e-05,constant,64,0.17376401705968364,PRUNED
13,4.110772132873535,2020-06-23 00:05:40.456453,2020-06-23 00:06:10.035752,0 days 00:00:29.579299000,0.0019808567884677065,0.99,0.025061824306255958,constant,32,0.42584554191977836,PRUNED
14,2.2183265686035156,2020-06-23 00:06:10.125567,2020-06-23 00:06:29.609594,0 days 00:00:19.484027000,0.00037018952114469217,0.99,0.8635536685618175,constant,256,0.16082754900239724,PRUNED
15,1.1455384492874146,2020-06-23 00:06:29.698893,2020-06-23 00:07:00.526053,0 days 00:00:30.827160000,1.4343309756465176e-06,0.95,0.00016846711344587208,constant,64,0.3125043660902338,PRUNED
16,4.9073805809021,2020-06-23 00:07:00.615912,2020-06-23 00:07:31.360636,0 days 00:00:30.744724000,0.04791271424773533,0.95,0.013021029689697882,constant,32,0.09219173920420964,PRUNED
17,1.4382989406585693,2020-06-23 00:07:31.482160,2020-06-23 00:08:02.573959,0 days 00:00:31.091799000,2.310719609836516e-05,0.999,0.00047755439648975643,linear,8,0.2658875710221361,PRUNED
18,4.220379829406738,2020-06-23 00:08:02.665620,2020-06-23 00:08:24.316446,0 days 00:00:21.650826000,4.001565916684877e-07,0.99,0.3252429098463966,constant,32,0.508008793635348,PRUNED
19,0.9830074310302734,2020-06-23 00:08:24.406264,2020-06-23 00:08:57.661054,0 days 00:00:33.254790000,0.00028121655497669794,0.98,6.566560361833377e-05,constant,512,0.43475744943245975,PRUNED
20,1.4889535903930664,2020-06-23 00:08:57.782289,2020-06-23 00:09:27.995910,0 days 00:00:30.213621000,1.3187086857268601e-05,0.995,0.01961214581194429,constant,64,0.08908687495774381,PRUNED
21,1.3073914051055908,2020-06-23 00:09:28.087401,2020-06-23 00:09:56.904244,0 days 00:00:28.816843000,1.18284878949422e-07,0.95,0.20375015252985812,constant,2048,0.020143344893524623,PRUNED
22,1.331117033958435,2020-06-23 00:09:56.995757,2020-06-23 00:10:28.703910,0 days 00:00:31.708153000,1.0960766409095146e-07,0.95,0.34243968854712675,constant,2048,0.09445109159581354,PRUNED
23,1.3084471225738525,2020-06-23 00:10:28.824590,2020-06-23 00:10:57.969672,0 days 00:00:29.145082000,0.003038730531577763,0.9999,0.09001883959930805,constant,2048,0.23279766511022357,PRUNED
24,1.1944968700408936,2020-06-23 00:10:58.063542,2020-06-23 00:11:32.315374,0 days 00:00:34.251832000,2.2530301385426416e-06,0.95,0.04305567032368379,constant,2048,0.3251276116892306,PRUNED
25,1.909186601638794,2020-06-23 00:11:32.437296,2020-06-23 00:11:54.344822,0 days 00:00:21.907526000,1.2934374213142549e-08,0.95,0.8101052349716468,constant,16,0.12376511288349934,PRUNED
26,1.2387233972549438,2020-06-23 00:11:54.434716,2020-06-23 00:12:22.867043,0 days 00:00:28.432327000,0.00013553442338603967,0.99,0.009438910101167382,linear,256,0.026936190891315055,PRUNED
27,2.8539321422576904,2020-06-23 00:12:22.958413,2020-06-23 00:12:53.930373,0 days 00:00:30.971960000,0.0902332482108803,0.95,0.0012237346109949473,constant,8,0.24071871566884628,PRUNED
28,1.3040353059768677,2020-06-23 00:12:54.052133,2020-06-23 00:13:25.006259,0 days 00:00:30.954126000,1.6820894605871745e-07,0.9999,0.21438985142385855,constant,2048,0.9964619628268778,PRUNED
29,1.978506326675415,2020-06-23 00:13:25.120527,2020-06-23 00:13:45.225646,0 days 00:00:20.105119000,4.27231284865861e-07,0.95,0.14827908894171427,constant,64,0.509606403357904,PRUNED
30,1.5421628952026367,2020-06-23 00:13:45.322609,2020-06-23 00:14:14.111460,0 days 00:00:28.788851000,0.01106861480173158,0.98,0.04285918317840812,constant,32,0.3982618422945703,PRUNED
31,1.0552788972854614,2020-06-23 00:14:14.201761,2020-06-23 00:14:46.101655,0 days 00:00:31.899894000,0.0017489394373765572,0.9,0.005666938051708745,constant,128,0.984400279881398,PRUNED
32,1.2314410209655762,2020-06-23 00:14:46.193360,2020-06-23 00:15:16.674387,0 days 00:00:30.481027000,0.0007975311268159218,0.9,0.0053211355544781225,constant,128,0.6276838602899406,PRUNED
33,1.0248997211456299,2020-06-23 00:15:16.796864,2020-06-23 00:15:52.928431,0 days 00:00:36.131567000,0.0009985982038659175,0.9,0.0005258586478079438,constant,128,0.7329990953589862,PRUNED
34,1.3985669612884521,2020-06-23 00:15:53.018578,2020-06-23 00:16:22.350387,0 days 00:00:29.331809000,0.005058480056814396,0.9,0.0028065701621135092,constant,16,0.8547084639431852,PRUNED
35,1.5082377195358276,2020-06-23 00:16:22.442598,2020-06-23 00:17:00.123990,0 days 00:00:37.681392000,0.02787430182832817,0.99,0.0007001497782702338,constant,1024,0.5847841991073597,COMPLETE
36,1.9766820669174194,2020-06-23 00:17:00.125079,2020-06-23 00:17:24.242659,0 days 00:00:24.117580000,0.00033964809141211286,0.999,0.48539910449009155,linear,128,0.7222943884175301,PRUNED
37,1.1467128992080688,2020-06-23 00:17:24.334958,2020-06-23 00:17:53.997735,0 days 00:00:29.662777000,9.250620648598868e-06,0.995,0.00573669696485863,constant,512,0.8581585489914035,PRUNED
38,1.4926180839538574,2020-06-23 00:17:54.088827,2020-06-23 00:18:27.051172,0 days 00:00:32.962345000,4.157074730132998e-05,0.95,0.056309578262945074,constant,128,0.2930670264811719,PRUNED
39,1.1669564247131348,2020-06-23 00:18:27.175214,2020-06-23 00:18:55.262315,0 days 00:00:28.087101000,2.856854482478034e-08,0.9,0.0016435112852537914,linear,1024,0.19811580281695612,PRUNED
40,1.5204126834869385,2020-06-23 00:18:55.352591,2020-06-23 00:19:18.451258,0 days 00:00:23.098667000,0.012789617619402149,0.99,0.02289853020554213,constant,64,0.3758905000302394,PRUNED
41,1.1573692560195923,2020-06-23 00:19:18.541521,2020-06-23 00:19:49.538901,0 days 00:00:30.997380000,0.048084711472524536,0.99,0.0008862880787107939,constant,1024,0.6154410061898296,PRUNED
42,1.557157039642334,2020-06-23 00:19:49.630184,2020-06-23 00:20:31.310532,0 days 00:00:41.680348000,0.03229461971701421,0.99,0.00011325049409277855,constant,1024,0.5498447611967905,COMPLETE
43,1.1419355869293213,2020-06-23 00:20:31.311593,2020-06-23 00:21:06.023993,0 days 00:00:34.712400000,0.005532261934916037,0.99,0.0004749484098725342,constant,1024,0.7971970952978099,PRUNED
44,1.499602198600769,2020-06-23 00:21:06.121656,2020-06-23 00:21:33.345512,0 days 00:00:27.223856000,0.00014811100101385657,0.99,0.0032953600133406027,constant,32,0.6823402979833225,PRUNED
45,2.351170301437378,2020-06-23 00:21:33.447704,2020-06-23 00:21:57.648145,0 days 00:00:24.200441000,0.020961126184495738,0.95,0.0002538272656696686,constant,8,0.9562781674053034,PRUNED
46,1.1869620084762573,2020-06-23 00:21:57.740315,2020-06-23 00:22:36.946175,0 days 00:00:39.205860000,0.0997134427840965,0.999,0.0006934972222368441,constant,256,0.46980690487373156,PRUNED
47,1.1976735591888428,2020-06-23 00:22:37.070861,2020-06-23 00:23:13.966104,0 days 00:00:36.895243000,0.0008284307602712435,0.99,1.647881273477184e-05,constant,1024,0.34196489197083385,PRUNED
48,1.5568726062774658,2020-06-23 00:23:14.089940,2020-06-23 00:23:48.235901,0 days 00:00:34.145961000,2.1467327776606344e-06,0.9,0.011038039273680333,constant,32,0.9250918040679107,PRUNED
49,1.2544652223587036,2020-06-23 00:23:48.336118,2020-06-23 00:24:24.556702,0 days 00:00:36.220584000,0.002332452662425283,0.9999,0.0017274381109534515,constant,64,0.5578287954377883,PRUNED
50,1.0271680355072021,2020-06-23 00:24:24.662225,2020-06-23 00:25:04.930649,0 days 00:00:40.268424000,4.055725806151799e-05,0.995,0.0003348386879692295,constant,2048,0.1352719816842442,PRUNED
51,1.5821754932403564,2020-06-23 00:25:05.064895,2020-06-23 00:25:50.680953,0 days 00:00:45.616058000,0.033847674713728036,0.99,8.901919164670951e-05,constant,1024,0.5584684047905429,COMPLETE
52,0.9254152178764343,2020-06-23 00:25:50.682194,2020-06-23 00:26:30.551287,0 days 00:00:39.869093000,0.023288575450490172,0.99,0.00012150221966040356,constant,1024,0.6735078669544214,PRUNED
53,1.1256332397460938,2020-06-23 00:26:30.694480,2020-06-23 00:27:08.842434,0 days 00:00:38.147954000,0.010922295170042451,0.99,3.833958933550706e-05,constant,1024,0.46084693242294766,PRUNED
54,0.9561269879341125,2020-06-23 00:27:08.950258,2020-06-23 00:27:52.040076,0 days 00:00:43.089818000,0.06698513079796162,0.99,3.4991896438796516e-05,constant,1024,0.5832651470997566,PRUNED
55,1.1214922666549683,2020-06-23 00:27:52.153182,2020-06-23 00:28:27.667460,0 days 00:00:35.514278000,0.0005231479701747543,0.98,0.00021063810147186273,constant,512,0.7703097380797799,PRUNED
56,2.806975841522217,2020-06-23 00:28:27.810779,2020-06-23 00:28:56.843922,0 days 00:00:29.033143000,0.003972007372968532,0.95,0.5355466751810485,constant,32,0.05532892253306287,PRUNED
57,1.2251352071762085,2020-06-23 00:28:56.946551,2020-06-23 00:29:33.643518,0 days 00:00:36.696967000,0.009413020726966991,0.99,0.0010742105019539649,linear,64,0.5342657182388744,PRUNED
58,1.3396987915039062,2020-06-23 00:29:33.750685,2020-06-23 00:30:21.365698,0 days 00:00:47.615013000,0.0001331498825166467,0.95,5.509087981723147e-05,constant,16,0.4085870795679185,PRUNED
59,1.183626413345337,2020-06-23 00:30:21.484337,2020-06-23 00:30:59.916007,0 days 00:00:38.431670000,6.782332683426245e-08,0.99,0.0001535948415112687,constant,2048,0.3599428734844501,PRUNED
60,1.5079988241195679,2020-06-23 00:31:00.050872,2020-06-23 00:31:36.176673,0 days 00:00:36.125801000,1.06146814999479e-08,0.95,0.015634384875115776,constant,128,0.45626005155563665,PRUNED
61,1.7063366174697876,2020-06-23 00:31:36.282602,2020-06-23 00:32:02.102103,0 days 00:00:25.819501000,0.0015779407303270156,0.999,0.1086003440361137,constant,1024,0.28222678184455485,PRUNED
62,1.5508091449737549,2020-06-23 00:32:02.237263,2020-06-23 00:32:42.181064,0 days 00:00:39.943801000,0.0071386610764902075,0.999,0.06628903566377221,constant,1024,0.1873851678192495,PRUNED
63,1.2129055261611938,2020-06-23 00:32:42.339801,2020-06-23 00:33:22.497490,0 days 00:00:40.157689000,0.03785056479915122,0.999,0.03667060723077215,constant,1024,0.4836529617123049,PRUNED
64,2.942302942276001,2020-06-23 00:33:22.617183,2020-06-23 00:34:04.798704,0 days 00:00:42.181521000,0.02085546603017957,0.999,0.9772617665058957,constant,2048,0.25072171896354123,PRUNED
65,1.5313814878463745,2020-06-23 00:34:04.927627,2020-06-23 00:34:45.682092,0 days 00:00:40.754465000,8.75957969262447e-07,0.9,0.2835082490465471,constant,256,0.30635280304436874,PRUNED
66,1.8598644733428955,2020-06-23 00:34:45.827286,2020-06-23 00:35:11.488978,0 days 00:00:25.661692000,0.0025404886125518634,0.9999,0.007980975337425146,constant,32,0.43452412780390987,PRUNED
67,1.1282697916030884,2020-06-23 00:35:11.605191,2020-06-23 00:35:50.964908,0 days 00:00:39.359717000,6.469719430811593e-06,0.95,0.12325215278683964,constant,64,0.21375086247533379,PRUNED
68,1.5446555614471436,2020-06-23 00:35:51.101434,2020-06-23 00:36:41.059786,0 days 00:00:49.958352000,0.0013956851469958946,0.98,0.00414193816247476,constant,1024,0.3829210371637942,COMPLETE
69,2.9758996963500977,2020-06-23 00:36:41.061095,2020-06-23 00:37:06.740953,0 days 00:00:25.679858000,0.00021844341576877566,0.98,0.0022336038010386666,constant,8,0.6010757624835995,PRUNED
70,0.9027841687202454,2020-06-23 00:37:06.857264,2020-06-23 00:37:53.216325,0 days 00:00:46.359061000,0.001251773524506983,0.98,0.003956707933953108,linear,1024,0.3451876778066462,PRUNED
71,1.129686713218689,2020-06-23 00:37:53.407405,2020-06-23 00:38:34.093298,0 days 00:00:40.685893000,0.0005860178025099305,0.98,0.008092723128932054,constant,1024,0.3833191652462418,PRUNED
72,0.9230664968490601,2020-06-23 00:38:34.207048,2020-06-23 00:39:19.789118,0 days 00:00:45.582070000,0.00296656439724464,0.98,0.004278120512843103,constant,1024,0.520776859919704,PRUNED
73,0.9574314951896667,2020-06-23 00:39:19.909277,2020-06-23 00:40:04.651208,0 days 00:00:44.741931000,0.005978620789244062,0.99,0.03347180866882267,constant,128,0.4159637343612308,PRUNED
74,1.4659755229949951,2020-06-23 00:40:04.798416,2020-06-23 00:40:58.294987,0 days 00:00:53.496571000,0.060971592351278456,0.9,0.015653259471700823,constant,1024,0.27345959137797027,COMPLETE
75,0.9269472360610962,2020-06-23 00:40:58.297178,2020-06-23 00:41:39.080700,0 days 00:00:40.783522000,2.176607589703451e-05,0.9,0.0022142602078039537,constant,1024,0.2662537006190464,PRUNED
76,0.9146251678466797,2020-06-23 00:41:39.217422,2020-06-23 00:42:18.085410,0 days 00:00:38.867988000,0.07939857790852989,0.9,0.017325053685794203,constant,1024,0.14030548563885026,PRUNED
77,1.146674633026123,2020-06-23 00:42:18.201160,2020-06-23 00:42:54.989016,0 days 00:00:36.787856000,0.014185778613294907,0.9,0.007034854899755663,constant,2048,0.6533631955902744,PRUNED
78,1.8818248510360718,2020-06-23 00:42:55.160186,2020-06-23 00:43:21.398911,0 days 00:00:26.238725000,0.055819257830526756,0.9,0.012770644369509707,constant,64,0.33428852794476677,PRUNED
79,1.5827504396438599,2020-06-23 00:43:21.532922,2020-06-23 00:43:49.562134,0 days 00:00:28.029212000,6.755637529504346e-05,0.995,0.0013263423093729408,constant,32,0.21703889711732915,PRUNED
80,1.260765790939331,2020-06-23 00:43:49.688187,2020-06-23 00:44:29.007927,0 days 00:00:39.319740000,0.03005939991241875,0.95,0.0029287369386506285,constant,512,0.1750455227445753,PRUNED
81,1.2791011333465576,2020-06-23 00:44:29.121855,2020-06-23 00:45:07.871020,0 days 00:00:38.749165000,0.00414231309895428,0.99,0.06417917337620013,constant,1024,0.36911627255410373,PRUNED
82,1.171973466873169,2020-06-23 00:45:08.056256,2020-06-23 00:45:46.795847,0 days 00:00:38.739591000,0.007682615385019333,0.999,0.028805171699414864,constant,1024,0.25892993621844923,PRUNED
83,1.5473586320877075,2020-06-23 00:45:46.931533,2020-06-23 00:46:27.481910,0 days 00:00:40.550377000,0.013919730583037807,0.9,0.20115579240961354,constant,1024,0.3036437545784616,PRUNED
84,1.1295497417449951,2020-06-23 00:46:27.596698,2020-06-23 00:47:07.920294,0 days 00:00:40.323596000,0.0013375297033035801,0.99,0.004460116231204481,constant,128,0.28324057595882873,PRUNED
85,1.2039825916290283,2020-06-23 00:47:08.081306,2020-06-23 00:47:50.566335,0 days 00:00:42.485029000,2.5349513799148063e-07,0.95,1.6149712944655793e-05,constant,16,0.4927476068650942,PRUNED
86,1.2981574535369873,2020-06-23 00:47:50.706285,2020-06-23 00:48:33.347657,0 days 00:00:42.641372000,0.04031349930730608,0.98,0.4948865987167039,constant,1024,0.3980946217079882,PRUNED
87,1.3948256969451904,2020-06-23 00:48:33.526052,2020-06-23 00:49:11.483536,0 days 00:00:37.957484000,0.0005054896548755045,0.99,0.0859446102717502,constant,1024,0.4465181989290036,PRUNED
88,1.1436396837234497,2020-06-23 00:49:11.609666,2020-06-23 00:49:56.987644,0 days 00:00:45.377978000,0.026439817818777744,0.9,0.006074503615988797,constant,64,0.10270290841226154,PRUNED
89,1.5844898223876953,2020-06-23 00:49:57.130150,2020-06-23 00:50:45.725080,0 days 00:00:48.594930000,0.09700568080415597,0.95,0.010038206296175566,constant,2048,0.0008614913343486554,COMPLETE
90,2.248265504837036,2020-06-23 00:50:45.727113,2020-06-23 00:51:31.879103,0 days 00:00:46.151990000,0.0163068671642992,0.99,0.643248053984327,constant,32,0.8217750752117758,PRUNED
91,1.1529991626739502,2020-06-23 00:51:32.001581,2020-06-23 00:52:10.990994,0 days 00:00:38.989413000,0.003626117350844727,0.99,9.767672456975061e-05,constant,1024,0.5952817866354769,PRUNED
92,1.1138651371002197,2020-06-23 00:52:11.155057,2020-06-23 00:52:46.604462,0 days 00:00:35.449405000,0.03569490855411642,0.99,7.000518299852328e-05,constant,1024,0.5461701104712995,PRUNED
93,1.1415519714355469,2020-06-23 00:52:46.726371,2020-06-23 00:53:24.005516,0 days 00:00:37.279145000,0.06256942118147046,0.99,0.0004158019434597627,constant,1024,0.5685842109362077,PRUNED
94,0.8883152008056641,2020-06-23 00:53:24.171397,2020-06-23 00:54:10.822174,0 days 00:00:46.650777000,0.017931872586379658,0.99,0.02064557392530066,linear,1024,0.6381299029831433,PRUNED
95,1.1173467636108398,2020-06-23 00:54:10.958496,2020-06-23 00:54:50.012879,0 days 00:00:39.054383000,0.008657572129093,0.999,0.0007202890930791948,constant,256,0.5189528613374654,PRUNED
96,1.189144492149353,2020-06-23 00:54:50.123554,2020-06-23 00:55:30.300916,0 days 00:00:40.177362000,0.0009917509760467241,0.9999,9.193170478363977e-05,constant,128,0.3234003512489261,PRUNED
97,1.3006452322006226,2020-06-23 00:55:30.470956,2020-06-23 00:56:13.586967,0 days 00:00:43.116011000,1.836790229912598e-08,0.995,2.6750737207535773e-05,constant,8,0.47316709719901956,PRUNED
98,1.81560480594635,2020-06-23 00:56:13.707033,2020-06-23 00:56:40.099546,0 days 00:00:26.392513000,0.05100201374012041,0.99,0.36997037832577157,constant,1024,0.35619115913868343,PRUNED
99,1.3467425107955933,2020-06-23 00:56:40.216331,2020-06-23 00:57:19.329383,0 days 00:00:39.113052000,0.001997274911959839,0.95,0.16641836329188014,constant,1024,0.7076165039535294,PRUNED
