number,value,datetime_start,datetime_complete,duration,params_batch_size,params_buffer_size,params_ent_coef,params_gamma,params_learning_starts,params_lr,params_n_sampled_goal,params_net_arch,params_random_exploration,params_target_entropy,params_train_freq,state
0,0.2176157683134079,2020-06-25 07:51:06.440591,2020-06-25 12:39:34.873201,0 days 04:48:28.432610000,64,100000,0.1,0.99,10000,1.104180814731717e-05,6,medium,0.8430311502702182,,300,COMPLETE
1,0.3022451102733612,2020-06-25 07:51:06.444424,2020-06-25 15:10:16.622699,0 days 07:19:10.178275000,128,10000,0.5,0.9,0,0.0064554023285977365,2,big,0.46797826250531105,,100,COMPLETE
2,1.5844573974609375,2020-06-25 07:51:06.447013,2020-06-25 12:19:10.517720,0 days 04:28:04.070707000,64,1000000,0.05,0.98,10000,5.258468558872915e-05,4,small,0.9689764588755102,,1,COMPLETE
3,2.226858377456665,2020-06-25 07:51:06.449500,2020-06-25 16:21:31.939931,0 days 08:30:25.490431000,512,1000000,0.1,0.9,20000,0.40894603830049175,8,medium,0.15908261768268972,,1,PRUNED
4,0.2879711985588074,2020-06-25 07:51:06.452357,2020-06-26 05:54:56.041699,0 days 22:03:49.589342000,512,100000,auto,0.9999,0,0.30005394491964243,6,medium,0.5772551296492962,-100,300,COMPLETE
5,0.5742749571800232,2020-06-25 07:51:06.455204,2020-06-25 12:41:23.277380,0 days 04:50:16.822176000,64,100000,0.01,0.98,10000,0.03512404414346544,6,big,0.3373640833208149,,10,COMPLETE
6,2.226858377456665,2020-06-25 07:51:06.457838,2020-06-25 11:05:13.883228,0 days 03:14:07.425390000,32,10000,0.0001,0.9,20000,0.02837142437151805,8,big,0.2530826835376797,,300,COMPLETE
7,1.9013313055038452,2020-06-25 07:51:06.460368,2020-06-25 16:23:04.024964,0 days 08:31:57.564596000,512,1000000,0.1,0.95,20000,0.5641895477795348,6,big,0.7798490745151049,,1,PRUNED
8,2.907468557357788,2020-06-25 07:51:06.463007,2020-06-25 14:42:21.201203,0 days 06:51:14.738196000,256,1000000,0.01,0.98,0,0.00011434445728956529,2,medium,0.6277149488990098,,1,PRUNED
9,1.2689404487609863,2020-06-25 07:51:06.465590,2020-06-25 10:24:39.554448,0 days 02:33:33.088858000,16,100000,0.1,0.98,0,0.011008856166088144,6,big,0.6973995546313975,,300,COMPLETE
10,0.18380016088485718,2020-06-25 07:51:06.468200,2020-06-25 10:22:13.363041,0 days 02:31:06.894841000,16,1000000,0.1,0.95,20000,5.141051723702394e-05,8,medium,0.3518822994345371,,10,COMPLETE
11,0.5593830347061157,2020-06-25 07:51:06.470758,2020-06-25 09:39:56.890127,0 days 01:48:50.419369000,16,100000,auto,0.9999,20000,0.00021890830158400988,2,small,0.3221105377188688,-20,100,COMPLETE
12,0.4060949385166168,2020-06-25 07:51:06.473761,2020-06-25 11:26:33.967460,0 days 03:35:27.493699000,32,1000000,0.1,0.99,1000,0.0003632248953861074,8,medium,0.20429700815622887,,300,COMPLETE
13,1.8014347553253174,2020-06-25 07:51:06.476348,2020-06-25 15:24:34.498342,0 days 07:33:28.021994000,128,10000,0.01,0.9,1000,6.026479695423849e-05,4,medium,0.5192292756266005,,300,COMPLETE
14,0.5086167454719543,2020-06-25 07:51:06.478966,2020-06-25 21:38:44.580277,0 days 13:47:38.101311000,256,1000000,0.5,0.995,0,0.052851944902933067,8,medium,0.9435518907011429,,300,COMPLETE
15,0.3078576922416687,2020-06-25 07:51:06.481659,2020-06-25 14:57:35.818563,0 days 07:06:29.336904000,128,100000,auto,0.99,20000,0.009128938878578649,8,medium,0.4810542803290905,-50,300,COMPLETE
16,2.2755610942840576,2020-06-25 07:51:06.484603,2020-06-25 09:45:19.721155,0 days 01:54:13.236552000,16,10000,0.0001,0.95,10000,9.989104192916531e-05,2,medium,0.01514928864397902,,1,COMPLETE
17,0.3897247314453125,2020-06-25 07:51:06.487419,2020-06-25 10:14:44.820014,0 days 02:23:38.332595000,16,10000,0.1,0.95,10000,5.5909972101791014e-05,6,medium,0.8898461492903755,,1,COMPLETE
18,0.3616695702075958,2020-06-25 07:51:06.490032,2020-06-25 21:54:41.065001,0 days 14:03:34.574969000,256,100000,0.01,0.95,0,0.02953892454326956,8,small,0.3443600361456354,,300,COMPLETE
19,2.405996322631836,2020-06-25 07:51:06.492989,2020-06-25 12:09:03.102190,0 days 04:17:56.609201000,128,1000000,auto,0.95,0,0.0030975631725064113,6,small,0.8573259631334939,-50,100,PRUNED
20,1.1978440284729004,2020-06-25 07:51:06.496013,2020-06-25 11:31:20.812366,0 days 03:40:14.316353000,64,1000000,0.0001,0.99,0,5.6211560482164174e-05,4,medium,0.23676192552779518,,1,PRUNED
21,3.5139803886413574,2020-06-25 07:51:06.498714,2020-06-26 05:38:11.136062,0 days 21:47:04.637348000,512,10000,0.01,0.9999,0,0.002634566837632241,6,small,0.25590426589517756,,10,COMPLETE
22,2.8919310569763184,2020-06-25 07:51:06.501218,2020-06-25 16:43:44.949223,0 days 08:52:38.448005000,512,1000000,auto,0.995,0,0.00018191235808687442,4,big,0.3628808497523106,-50,300,PRUNED
23,2.8382444381713867,2020-06-25 07:51:06.504177,2020-06-25 11:38:22.308800,0 days 03:47:15.804623000,64,100000,0.1,0.999,0,0.17952491845263535,1,medium,0.8735674664449093,,1,PRUNED
24,0.3863863945007324,2020-06-25 07:51:06.506777,2020-06-25 10:21:01.878389,0 days 02:29:55.371612000,32,100000,0.05,0.95,20000,0.013896232682797837,2,big,0.33007831031162915,,10,COMPLETE
25,1.331337809562683,2020-06-25 07:51:06.509377,2020-06-26 03:45:29.661974,0 days 19:54:23.152597000,512,100000,0.01,0.98,20000,0.15087153669258038,2,small,0.3321883883274137,,10,COMPLETE
26,4.351542949676514,2020-06-25 07:51:06.512781,2020-06-25 10:57:29.263563,0 days 03:06:22.750782000,32,10000,0.0001,0.9999,1000,0.05813391145447561,4,big,0.5719416296984775,,10,COMPLETE
27,3.8383898735046387,2020-06-25 07:51:06.515574,2020-06-25 12:38:51.324617,0 days 04:47:44.809043000,512,1000000,auto,0.98,20000,8.068398931177207e-05,8,big,0.8756191312459518,-50,10,PRUNED
28,0.1081055998802185,2020-06-25 07:51:06.518718,2020-06-25 15:16:42.629682,0 days 07:25:36.110964000,128,1000000,0.5,0.98,0,0.00015721498327357606,2,medium,0.6415024561966096,,10,COMPLETE
29,0.4552405774593353,2020-06-25 07:51:06.536025,2020-06-25 11:30:37.484220,0 days 03:39:30.948195000,32,100000,0.1,0.995,0,0.02951436107152333,8,big,0.917825460128234,,1,COMPLETE
30,3.682166337966919,2020-06-25 07:51:06.538855,2020-06-25 10:43:57.801569,0 days 02:52:51.262714000,32,100000,0.5,0.98,1000,0.08086680533137708,2,big,0.8109499809841898,,1,COMPLETE
31,5.454268455505371,2020-06-25 07:51:06.553703,2020-06-25 14:51:46.758782,0 days 07:00:40.205079000,128,10000,0.1,0.995,20000,0.3546064592991356,8,big,0.08777925549926535,,1,COMPLETE
32,1.2408825159072876,2020-06-25 09:39:56.906418,2020-06-25 18:38:59.904433,0 days 08:59:02.998015000,512,1000000,0.5,0.95,0,4.850227457447839e-05,2,medium,0.1104458071053227,,10,PRUNED
33,0.5439476370811462,2020-06-25 09:45:19.725439,2020-06-25 20:37:55.113598,0 days 10:52:35.388159000,256,1000000,0.5,0.9,20000,0.0191849600075402,2,small,0.21313365707153098,,10,COMPLETE
34,1.9306014776229858,2020-06-25 10:14:44.824226,2020-06-25 11:56:17.251141,0 days 01:41:32.426915000,16,100000,0.05,0.95,0,0.04443479094261983,1,medium,0.7813501644340741,,1,COMPLETE
35,4.680002212524414,2020-06-25 10:21:01.894969,2020-06-25 14:56:01.626673,0 days 04:34:59.731704000,256,10000,0.01,0.9,1000,0.25897253717439583,2,medium,0.017226900075775098,,1,PRUNED
36,3.1837809085845947,2020-06-25 10:22:13.419586,2020-06-25 12:03:41.831391,0 days 01:41:28.411805000,64,1000000,0.5,0.999,20000,0.007487117788670558,6,big,0.9880106040386741,,100,PRUNED
37,5.491853713989258,2020-06-25 10:24:39.592310,2020-06-25 11:29:58.343492,0 days 01:05:18.751182000,64,10000,0.01,0.9,20000,0.4387513011134982,4,medium,0.4803606637368517,,10,PRUNED
38,5.340336322784424,2020-06-25 10:43:57.820972,2020-06-25 11:33:56.844581,0 days 00:49:59.023609000,16,100000,0.01,0.999,20000,0.0016658220797707306,1,big,0.4485135306814585,,300,PRUNED
39,0.6459707617759705,2020-06-25 10:57:29.266536,2020-06-26 06:18:14.571078,0 days 19:20:45.304542000,512,10000,0.1,0.9,1000,0.013281249206580078,8,big,0.6130896205359024,,1,COMPLETE
40,1.32448148727417,2020-06-25 11:05:13.890961,2020-06-26 06:05:08.544810,0 days 18:59:54.653849000,512,10000,0.01,0.98,1000,7.056463190104154e-05,2,medium,0.07902745334620342,,100,COMPLETE
41,1.4976425170898438,2020-06-25 11:26:34.001717,2020-06-25 14:06:05.680118,0 days 02:39:31.678401000,128,1000000,0.01,0.999,20000,1.3582529592161276e-05,1,medium,0.006682108000801379,,10,PRUNED
42,0.6089334487915039,2020-06-25 11:30:00.086101,2020-06-25 17:05:59.863218,0 days 05:35:59.777117000,128,1000000,0.05,0.95,20000,0.002334147090196517,1,small,0.3921468704223175,,10,COMPLETE
43,0.8075438737869263,2020-06-25 11:30:37.506722,2020-06-26 05:23:03.930018,0 days 17:52:26.423296000,512,1000000,0.05,0.999,20000,0.0016903467471270914,1,small,0.00853149325000957,,10,COMPLETE
44,0.33535659313201904,2020-06-25 11:31:23.618123,2020-06-25 17:12:14.887249,0 days 05:40:51.269126000,128,1000000,0.05,0.999,20000,0.0018117035330696167,1,small,0.012986341260858347,,10,COMPLETE
45,0.2648993730545044,2020-06-25 11:33:59.086206,2020-06-25 17:47:46.040663,0 days 06:13:46.954457000,128,1000000,0.05,0.95,20000,0.0010809076089017297,8,small,0.015128926868868853,,10,COMPLETE
46,1.1787806749343872,2020-06-25 11:38:24.499316,2020-06-25 15:37:42.027658,0 days 03:59:17.528342000,256,1000000,0.05,0.95,20000,1.4012900798948097e-05,2,small,0.09128040281700445,,10,PRUNED
47,0.35654494166374207,2020-06-25 11:56:17.268822,2020-06-26 05:33:42.768009,0 days 17:37:25.499187000,512,1000000,0.05,0.95,20000,1.0942909935255531e-05,2,small,0.05577075258300218,,10,COMPLETE
48,0.46710023283958435,2020-06-25 12:03:44.650780,2020-06-25 18:02:53.819813,0 days 05:59:09.169033000,128,1000000,0.05,0.95,20000,1.0045827864923237e-05,2,small,0.04544272729462773,,10,COMPLETE
49,1.8300355672836304,2020-06-25 12:09:05.892112,2020-06-26 05:31:10.961811,0 days 17:22:05.069699000,512,1000000,0.05,0.95,20000,1.0163507067299174e-05,2,small,0.08812285921975338,,10,COMPLETE
50,1.0027750730514526,2020-06-25 12:19:10.537685,2020-06-25 23:30:52.580226,0 days 11:11:42.042541000,256,1000000,0.05,0.95,20000,1.2951899390852504e-05,8,big,0.07761312074277366,,10,COMPLETE
51,0.6342762112617493,2020-06-25 12:38:53.755329,2020-06-25 22:59:29.541428,0 days 10:20:35.786099000,256,1000000,0.05,0.95,20000,0.0007629117830044324,2,medium,0.11815280198470005,,10,COMPLETE
52,0.7063599228858948,2020-06-25 12:39:34.891905,2020-06-25 19:46:11.905334,0 days 07:06:37.013429000,256,100000,0.05,0.99,10000,1.6547806344326693e-05,2,medium,0.33479597507571135,,10,PRUNED
53,1.0419352054595947,2020-06-25 12:41:23.328651,2020-06-25 23:13:35.518812,0 days 10:32:12.190161000,256,100000,0.05,0.99,20000,1.3040552155706911e-05,2,medium,0.09750861445575099,,10,COMPLETE
54,0.44205087423324585,2020-06-25 14:06:08.043869,2020-06-26 01:57:19.623648,0 days 11:51:11.579779000,256,100000,0.05,0.99,10000,1.1399738671450889e-05,2,medium,0.14332237988346078,,10,COMPLETE
55,0.2640421986579895,2020-06-25 14:42:23.817183,2020-06-26 06:19:08.622564,0 days 15:36:44.805381000,512,100000,0.05,0.99,10000,1.7673030748976233e-05,2,medium,0.09704364570353108,,10,COMPLETE
56,1.5400861501693726,2020-06-25 14:51:46.761729,2020-06-26 06:23:15.480051,0 days 15:31:28.718322000,512,100000,0.05,0.99,10000,1.5706525066256463e-05,2,medium,0.3872430663256433,,10,COMPLETE
57,1.0709935426712036,2020-06-25 14:56:03.457801,2020-06-26 06:23:01.515968,0 days 15:26:58.058167000,512,100000,0.05,0.99,10000,1.0069193715869063e-05,2,medium,0.35971064729644414,,10,COMPLETE
58,1.1872360706329346,2020-06-25 14:57:35.836956,2020-06-25 21:37:20.008634,0 days 06:39:44.171678000,128,100000,auto,0.99,10000,1.1993605132069611e-05,8,medium,0.43808620998025716,-100,300,COMPLETE
59,0.38554927706718445,2020-06-25 15:10:16.626063,2020-06-26 06:23:12.793460,0 days 15:12:56.167397000,512,10000,0.5,0.9,10000,1.1302251485813143e-05,6,small,0.5788288603969023,,100,COMPLETE
60,1.322052001953125,2020-06-25 15:16:42.643763,2020-06-26 06:25:20.428764,0 days 15:08:37.785001000,512,1000000,0.5,0.99,10000,1.1060192561533136e-05,6,medium,0.7036981595404016,,10,COMPLETE
61,1.9603073596954346,2020-06-25 15:24:34.502804,2020-06-26 06:25:25.417366,0 days 15:00:50.914562000,512,1000000,0.5,0.99,10000,1.1531991486000384e-05,6,medium,0.7255817313292241,,10,COMPLETE
62,1.1462081670761108,2020-06-25 15:37:44.360909,2020-06-26 06:24:56.984034,0 days 14:47:12.623125000,512,1000000,0.5,0.99,10000,0.001219313883253921,2,medium,0.4132004712086712,,100,COMPLETE
63,1.9738609790802002,2020-06-25 16:21:35.386357,2020-06-25 22:31:09.769282,0 days 06:09:34.382925000,128,1000000,0.5,0.99,10000,2.6327206257779252e-05,2,medium,0.40176156978164135,,100,COMPLETE
64,3.3879566192626953,2020-06-25 16:23:07.126875,2020-06-25 22:43:48.136708,0 days 06:20:41.009833000,128,1000000,0.5,0.99,10000,2.7378742994216934e-05,2,medium,0.3994187153104041,,100,COMPLETE
65,0.6983667612075806,2020-06-25 16:43:47.660718,2020-06-25 22:49:13.569711,0 days 06:05:25.908993000,128,1000000,0.5,0.99,10000,0.0012962788255842402,2,medium,0.6720935367513277,,100,COMPLETE
66,0.47502008080482483,2020-06-25 17:05:59.882229,2020-06-25 23:25:23.567292,0 days 06:19:23.685063000,128,1000000,0.5,0.99,10000,0.0005281365888034432,2,medium,0.7046019129147814,,100,COMPLETE
67,1.743019700050354,2020-06-25 17:12:14.900700,2020-06-25 23:32:46.035607,0 days 06:20:31.134907000,128,1000000,0.5,0.99,10000,2.241047996943668e-05,2,medium,0.6648644215092286,,100,COMPLETE
68,1.7582123279571533,2020-06-25 17:47:46.061609,2020-06-26 00:49:52.101842,0 days 07:02:06.040233000,128,1000000,0.5,0.99,10000,0.0006562488201219148,8,small,0.6914154171994591,,10,COMPLETE
69,1.992084264755249,2020-06-25 18:02:53.836171,2020-06-25 20:09:37.615579,0 days 02:06:43.779408000,64,1000000,0.5,0.99,10000,0.0006857774407537014,8,medium,0.6524448229399786,,10,PRUNED
70,1.8401901721954346,2020-06-25 18:39:02.377991,2020-06-25 22:43:56.992228,0 days 04:04:54.614237000,64,1000000,0.5,0.99,10000,0.0006348986036787825,8,medium,0.6964848350608863,,10,COMPLETE
71,3.3256468772888184,2020-06-25 19:46:14.456909,2020-06-26 00:01:15.758368,0 days 04:15:01.301459000,64,1000000,0.5,0.98,10000,0.0005837739702132029,8,small,0.6997563654481529,,10,COMPLETE
72,0.3664097487926483,2020-06-25 20:09:41.106594,2020-06-26 03:29:58.790176,0 days 07:20:17.683582000,128,1000000,0.5,0.9,10000,2.715349747967429e-05,8,small,0.5723949370177407,,100,COMPLETE
73,0.38439640402793884,2020-06-25 20:37:55.127572,2020-06-26 03:35:48.188477,0 days 06:57:53.060905000,128,1000000,0.5,0.98,10000,2.592198552331968e-05,8,medium,0.6901426463410485,,100,COMPLETE
74,0.528241753578186,2020-06-25 21:37:20.031008,2020-06-26 04:24:09.145591,0 days 06:46:49.114583000,128,1000000,0.5,0.98,0,2.3650594479584563e-05,6,small,0.7109538711593415,,100,COMPLETE
75,0.31496143341064453,2020-06-25 21:38:44.618514,2020-06-26 04:00:22.338133,0 days 06:21:37.719619000,128,10000,0.1,0.98,10000,2.648329987367947e-05,6,small,0.6634164481632218,,100,COMPLETE
76,0.4408596456050873,2020-06-25 21:54:41.092408,2020-06-26 04:10:49.719089,0 days 06:16:08.626681000,128,10000,0.1,0.98,10000,2.6640765484298753e-05,6,medium,0.6834283068444225,,100,COMPLETE
77,1.6912771463394165,2020-06-25 22:31:09.783981,2020-06-26 00:35:34.237692,0 days 02:04:24.453711000,128,10000,0.1,0.98,10000,0.000673574971055121,6,medium,0.6942563311275085,,100,PRUNED
78,1.3515559434890747,2020-06-25 22:43:48.149885,2020-06-26 00:55:14.965115,0 days 02:11:26.815230000,16,10000,0.1,0.98,0,0.0007350601162457694,6,small,0.7176595307184286,,100,COMPLETE
79,3.5659687519073486,2020-06-25 22:43:57.035910,2020-06-26 00:56:49.855258,0 days 02:12:52.819348000,16,10000,0.1,0.98,0,0.004877857141530224,6,small,0.5582064399558211,,100,COMPLETE
80,1.6301883459091187,2020-06-25 22:49:13.579940,2020-06-26 00:58:54.315554,0 days 02:09:40.735614000,16,10000,0.1,0.98,0,0.005241431000531154,6,small,0.578108942269203,,100,COMPLETE
81,3.592947006225586,2020-06-25 22:59:29.553502,2020-06-26 04:51:56.703765,0 days 05:52:27.150263000,128,10000,0.1,0.98,0,0.005163874930917845,6,small,0.5400317148150613,,100,COMPLETE
82,1.5454667806625366,2020-06-25 23:13:35.534026,2020-06-26 03:52:07.323446,0 days 04:38:31.789420000,128,10000,0.1,0.98,0,0.006045081967193435,6,small,0.562404156779132,,300,PRUNED
83,1.664878487586975,2020-06-25 23:25:23.594610,2020-06-26 00:12:17.538700,0 days 00:46:53.944090000,16,10000,0.1,0.9999,0,0.00018631009090474198,6,small,0.5866305434512984,,300,PRUNED
84,2.0995638370513916,2020-06-25 23:30:52.600912,2020-06-26 01:41:28.743859,0 days 02:10:36.142947000,16,10000,0.1,0.9999,0,0.0057867860385881365,6,small,0.5548321071719607,,300,COMPLETE
85,0.7440406084060669,2020-06-25 23:32:46.053432,2020-06-26 01:41:24.932052,0 days 02:08:38.878620000,16,10000,0.1,0.9,0,0.006135775412574583,6,small,0.5550884254042647,,300,COMPLETE
86,2.191037893295288,2020-06-26 00:01:15.806368,2020-06-26 00:48:43.412715,0 days 00:47:27.606347000,16,10000,0.1,0.98,0,0.0036161367303044058,6,medium,0.5674667758209121,,300,PRUNED
87,2.4008567333221436,2020-06-26 00:12:19.788892,2020-06-26 02:55:32.537905,0 days 02:43:12.749013000,128,100000,0.1,0.98,0,0.006891908297642938,6,medium,0.5202535629803497,,300,PRUNED
88,5.887325286865234,2020-06-26 00:35:36.276212,2020-06-26 01:25:29.483568,0 days 00:49:53.207356000,16,100000,auto,0.9,0,0.005669754073316995,8,medium,0.27936721663260417,auto,300,PRUNED
89,3.023132085800171,2020-06-26 00:48:45.717494,2020-06-26 03:30:15.477710,0 days 02:41:29.760216000,128,100000,auto,0.9,0,0.0060311910259986225,8,medium,0.28179559592055503,auto,300,PRUNED
90,0.6198565363883972,2020-06-26 00:49:52.132157,2020-06-26 05:41:55.848067,0 days 04:52:03.715910000,128,100000,auto,0.9,0,0.006067431563503147,8,medium,0.2657959457722618,-1,300,COMPLETE
91,0.4659159779548645,2020-06-26 00:55:14.978413,2020-06-26 05:44:20.720592,0 days 04:49:05.742179000,128,100000,auto,0.9,0,0.006359211223759807,8,medium,0.5039557788414641,-10,300,COMPLETE
92,2.6298468112945557,2020-06-26 00:56:49.861805,2020-06-26 02:21:02.142441,0 days 01:24:12.280636000,128,100000,auto,0.9,20000,0.006523102092532063,8,small,0.2839894528445099,auto,300,PRUNED
93,8.810396194458008,2020-06-26 00:58:54.321510,2020-06-26 02:20:38.783306,0 days 01:21:44.461796000,128,100000,auto,0.9,20000,0.009997160767600426,8,small,0.276612295451725,-50,300,PRUNED
94,3.7935633659362793,2020-06-26 01:25:32.194513,2020-06-26 03:09:01.077218,0 days 01:43:28.882705000,128,100000,auto,0.999,20000,0.00029510593683737757,1,small,0.5104772217240667,-100,300,PRUNED
95,2.155524730682373,2020-06-26 01:41:24.945485,2020-06-26 02:44:41.539585,0 days 01:03:16.594100000,128,100000,auto,0.999,20000,0.010181140979903651,1,small,0.16069318001905716,-10,300,PRUNED
96,4.321467399597168,2020-06-26 01:41:28.750245,2020-06-26 05:17:08.862960,0 days 03:35:40.112715000,128,100000,auto,0.999,20000,0.00027503613609254255,1,big,0.5065416900548816,-20,300,COMPLETE
97,1.3466863632202148,2020-06-26 01:57:19.630962,2020-06-26 02:57:30.941447,0 days 01:00:11.310485000,128,100000,auto,0.999,20000,0.000281621025506815,1,big,0.4749164949805185,-20,300,PRUNED
98,2.1904208660125732,2020-06-26 02:20:41.612539,2020-06-26 03:20:54.910904,0 days 01:00:13.298365000,128,100000,0.0001,0.999,20000,0.00032342615707796953,1,big,0.49729650996981867,,10,PRUNED
99,1.543625831604004,2020-06-26 02:21:04.916595,2020-06-26 03:23:52.098411,0 days 01:02:47.181816000,128,1000000,auto,0.999,20000,0.0002684886573636041,1,big,0.5131171623554664,-50,10,PRUNED
